goods-title-link--jump,goods-title-link--jump href,rank-title,rank-sub,price,discount,selling_proposition,goods-title-link
Unknown,Unknown,Unknown,Unknown,9.9,0.0,100+ sold recently,"New Wireless Electric Single-Head Double-Bar USB Electric Mixer, Mini Cream Automatic Beater For Home Use, Cake Baking, Handheld Rechargeable, High Power Quick Mixing Food Blender, Electric Egg Beater (White/Black)"
Unknown,Unknown,#10 Best Sellers,in Electric Kettles,17.3,0.0,Unknown,"Electric Kettle, Stainless Steel Kettle, Household Electric Kettle"
Unknown,Unknown,Unknown,Unknown,7.3,0.0,1.2k+ sold recently,"1pc, Mini Portable Foldable Fan With Spray Humidifier USB Rechargeable Handheld Fan With Water Mist, Cooling Comfort For Indoor & Outdoor Travel, Living Room Classroom, School Bedroom, Office Outdoor Sports, Picnic Travel, Summer Essential, Beach Vacation Essential Back To School Supplies"
Unknown,Unknown,Unknown,Unknown,5.8,0.0,100+ sold recently,"Mini Makeup Brush, Eyelashes Cleaner Device Electric Automatic Washing Machine Sponge Cleaning Toy For Girls Ladies. Cute And Helpful: To Wash Your Makeup Brushes, Sponge, Powder Puff. 1pc Automatic Cleaning Washing Machine For Makeup Brush Sponge Eyelash, Makeup Tool Cleaner With Dry Bucket For Makeup Tool, Makeup Sponge Washing Machine, Deep Clean Mini Washing Machine, Electronic Washing Machine For Makeup Sponge, Powder Puffs"
Unknown,Unknown,#6 Best Sellers,in Beauty & Body Care Appliances,2.8,3.0,Unknown,Mini Bendable USB Nail Dryer Foldable UV LED Lamp For Nails Gel Polish Drying Glue Nail Drying Lamp Nail Art Manicure Tools
Unknown,Unknown,#2 Best Sellers,in Digital Kitchen Scales,8.3,0.0,Unknown,"1pc Mini Kitchen Baking Coffee Food Electronic Scale I2000, Square, Suitable For Home Cooking (Without Battery)"
Unknown,Unknown,#2 Best Sellers,in Hair Dryers,25.5,4.0,Unknown,"Professional Ionic Hair Dryer,1800W Quick Dry Low Noise Hair Dryer With 2 Concentrator Nozzles, 1 Diffuser Attachment For Home Lightweight Travel Hairdryer Salon Hair Blow Dryer Hair Care Gift"
Unknown,Unknown,Unknown,Unknown,7.25,59.0,10+ sold recently,"PANCERKA 1 Set Electric Spin Scrubber With 5 Replaceable Brush Head, TYPE-C Rechargeable Power Cord Electric Cleaning Brush, Three-Speed Adjustable Handheld Shower Scrubber For Bathroom, Kitchen, Bathtub, Tile, Shower, Cleaning Supplies"
Unknown,Unknown,Unknown,Unknown,7.2,0.0,40+ sold recently,"1pc Wooden Roller Massage Stick, Legs, Back, Belly, Limbs, Neck And More Can Be Used, White Nine Wheels, Red Nine Wheels, Multiple Colors Available"
Unknown,Unknown,Unknown,Unknown,2.8,0.0,300+ sold recently,"Mini Usb Mouse Shaped Uv Lamp For Nail Art, With Gel Polish And Top/base Coat, No Dark Skin, Fast Drying And Long Lasting"
Unknown,Unknown,Unknown,Unknown,9.4,7.0,200+ sold recently,"1pc Smart Temperature Display Insulated Coffee Cup, Stainless Steel Portable Travel Mug, Double Wall Vacuum Insulated Cooler Mug For Hot And Cold Drinks, Holiday Gifts"
Unknown,Unknown,#10 Best Sellers,in Air Fryers,3.8,0.0,Unknown,"Round Air Fryer Parchment Paper, Oil-absorbing And Non-stick, Suitable For Baking And Roasting In Air Fryer"
Unknown,Unknown,Unknown,Unknown,23.9,0.0,100+ sold recently,"1pc Household Floor Sweeper,Upgrade Hand-Pushed Sweeping Robot With Dustpan Set - 2 In 1 Machine For Hardwood Surfaces, Wood Floors, Laminate, Tile - Small & Portable Broom, Cleans Dust Pet Hair, Manual Hand Push Mop Vacuum Cleaner"
Unknown,Unknown,#1 Best Sellers,in Water and Ice Dispensers,6.4,0.0,Unknown,"Wireless Usb Rechargeable Electric Water Pump Dispenser, Portable Pure Drinking Water Bottled Switch, Two Use For Home Office Kitchen Outdoor, Black & White, Size: 130*90*65mm/5.11*3.54*2.55inch"
Unknown,Unknown,#2 Best Sellers,in Hair Clippers,3.4,0.0,Unknown,"1pc Dragon & Phoenix Pattern Rechargeable Men's Hair Clipper, ABS Material, Portable & Professional For Home & Travel Use"
Unknown,Unknown,#4 Best Sellers,in Electric Salt & Pepper Grinders,6.4,0.0,Unknown,"2-In-1 Salt And Pepper Grinder Set, Double-Head Spice Grinder, Manual Pepper Mill -Household Sea Salt Ginder, Stainless Steel Spice Grinder, Manual Pepper Mill, Spice Crusher, Reusable Spice Bottle For BBQ Picnic Camping, Kitchen Gadgets, Gifts, Dorm Essentials, Back To School Supplies"
Unknown,Unknown,Unknown,Unknown,42.7,0.0,Unknown,1pc Rechargeable  S2509 Electric Shaver Three-Dimensional Floating Cutterhead 1 Hour Fast Charging 50-Minute Battery Life
Unknown,Unknown,Unknown,Unknown,7.9,0.0,1.8k+ sold recently,"Mini Handheld Fan With 5 Speeds Wind Display, Portable & Quiet Fan For Office Desktop, Dorm Room, Rechargeable & Hand-held Fan For Outdoor Use"
Unknown,Unknown,Unknown,Unknown,8.2,0.0,20+ sold recently,"1pc Mini Portable Fan, Handheld Fan Personal Mini Fan USB Rechargeable With 5 Speeds, 90° Foldable Battery Operated Mini Fan With LED Display, Desk Fan Working Time For Office Bedroom Outdoor Travel Camping Back To School Supplies"
Unknown,Unknown,Unknown,Unknown,3.29,35.0,100+ sold recently,"Teckwe Fabric Shaver Lint Remover For Clothes,Mini Portable Hair Ball Trimmer Sweater Defuzzer Remove Fuzz,Lint Balls,Pills,Bobbles From Clothes,Furniture,Carpet,Couch (Batteries Not Included)"
Unknown,Unknown,Unknown,Unknown,21.2,0.0,100+ sold recently,"Telescopic USB Rechargeable Foldable Portable Mini Fan For Dormitory Outdoor Activities, Portable USB Fan"
Unknown,Unknown,Unknown,Unknown,9.1,0.0,200+ sold recently,1pc Portable Stroller Fan Flexible Tripod Clip On Fan With 3 Speeds And Rotatable Handheld Personal Fan For Car Seat Crib Bike Treadmill
Unknown,Unknown,Unknown,Unknown,13.4,0.0,100+ sold recently,1pc Italian Style  Espresso Maker - Aluminum Moka Pot for Strong and Flavored Coffee - Easy to Operate and Clean
Unknown,Unknown,Unknown,Unknown,2.9,3.0,90+ sold recently,1pc ABS Portable Charging Electric Eyebrow Trimmer Women's Eyebrow Pencil Automatic Eyebrow Knife Facial Hair Removal Beauty Trimmer Lipstick Shaver
Unknown,Unknown,#4 Best Sellers,in Hair Straightening Irons,17.4,0.0,Unknown,"Professional All-in-one Hair Drying Brush, Hot Air Brush, Hair Dryer Brush, Hair Styling Brush For Drying, Curling And Modeling Hair"
Unknown,Unknown,Unknown,Unknown,6.3,0.0,20+ sold recently,"Bladeless Halter Fan Slouchy, Silent, Portable Mini Foldable Fan With Three Speeds And Long Battery Life"
Unknown,Unknown,Unknown,Unknown,5.3,0.0,Unknown,"1pc Compact And Portable Battery-Free High Quality Plastic Thermometer Hygrometer, White Circle Shape, Physically Induced High Precision Temperature And Humidity Measurement, Suitable For Home/Office/Warehouse/Laboratory/Greenhouse, For All Seasons"
Unknown,Unknown,Unknown,Unknown,13.88,22.0,100+ sold recently,"Wireless Vacuum Cleaner With Strong Suction Power And Multi-Functional Handheld Design - Suitable For Home, Commercial, Car, Industrial And Outdoor Use - Can Be Used For Cleaning Floors And As A Dust Collector"
Unknown,Unknown,#4 Best Sellers,in Exhaust Fans,12.9,0.0,Unknown,Desktop Leafless Fan Home Office Tower Fan Floor Leafless Tower Fan USB Rechargeable Portable Tower Fan
Unknown,Unknown,Unknown,Unknown,5.0,0.0,2.6k+ sold recently,"Silently Cool The Air Anywhere: Portable, Durable Mini Fan With High Performance USB Rechargeable Battery - Your Convenient Cool Companion"
Unknown,Unknown,#1 Best Sellers,in Ultrasonic Cleaners,6.0,6.0,Unknown,"Multifunctional Cleaner, Makeup Storage Cleaning, Jewelry Cleaning, Silverware Cleaning, Suitable For Glasses, Rings, Earrings, Necklaces, Watch Straps, Makeup Brushes"
Unknown,Unknown,Unknown,Unknown,4.23,10.0,60+ sold recently,"Versatile 5-In-1 Electric Epilator For Painless Hair Removal - Precision Trimmer For Bikini, Eyebrow & Body - Portable & Battery-Operated For Home And Travel Use"
Unknown,Unknown,#3 Best Sellers,in Curling Tongs & Curling Wands,11.23,8.0,Unknown,3 Barrels Hair Curling Roll Ceramic Iron 22Mm Temperature Adjustable Portable 3 Barrels Wave Iron Wand Curler Diy Curly Hair Styling Tools Gift
Unknown,Unknown,#4 Best Sellers,in Hand Blenders,15.3,0.0,Unknown,Household Handheld Egg White Cream Electric Mixer
Unknown,Unknown,#6 Best Sellers,in Curling Tongs & Curling Wands,25.7,4.0,Unknown,"1 Piece Automatic Curling Lron, Electric Heatedhair Curler, Automatical Rotating Curling Lronsportable Heated Hair Styling Tool For Home,Salon, Barbershop, Beauty Products Curling Wand"
Unknown,Unknown,#4 Best Sellers,in Blenders,20.5,0.0,Unknown,"PANCERKA Electric Vegetable Chopper & Mini Food Processor, Electric Food Chopper 1.5-Cup, For Dicing, Mincing, And Puree, Black"
Unknown,Unknown,#8 Best Sellers,in Vacuum Food Sealers,18.09,10.0,Unknown,"Vacuum Sealer Machine With Dry/Wet/External Vacuum System Modes, Led Display, Automatic And Manual Options For Food Storage And Air Sealing"
Unknown,Unknown,Unknown,Unknown,3.3,8.0,60+ sold recently,1pc Rechargeable 500mAh Battery Portable Handheld Mini Fan With 3 Adjustable Speed Levels
Unknown,Unknown,Unknown,Unknown,26.0,0.0,30+ sold recently,"1pc Multi-Functional Anti-Gravity Humidifier With Clock, Night Light, And Ornament - Enhance Your Home's Atmosphere And Health"
Unknown,Unknown,#8 Best Sellers,in Laundry Appliances,15.72,28.0,Unknown,"PANCERKA Steamer For Clothes, Garment Steamer, Handheld Garment Steamer, Portable Fabric Steamer, Clothes Wrinkle Remover, Home Ironing Machine, Suitable For Travel And Home Use - Fast Heating"
Unknown,Unknown,#4 Best Sellers,in Juicer & Food Processor,78.1,0.0,Unknown,Slow Masticating Juicer Cold Press Juice Extractor Apple Orange Citrus Juicer Machine with Wide Chute Quiet Motor for Fruit Vegetables
Unknown,Unknown,Unknown,Unknown,15.9,0.0,80+ sold recently,"MINI Fascia Gun Men's And Women's Creative Pocket Machine Portable Meridians Massage Parlor Electric Health Equipment Mini Fascia Gun,Massage Gun"
Unknown,Unknown,Unknown,Unknown,14.7,0.0,400+ sold recently,"1200mah Rechargeable Foldable Desktop Fan/Wall-Mounted Fan/Portable Air Conditioner, Foldable Fan, Table Fan, Mini Portable Fan, Suitable For Office, Home, Kitchen, Outdoor, 90° Adjustable, Quiet Operation, With Trackless Hook, Three Adjustable Speeds"
Unknown,Unknown,Unknown,Unknown,25.3,0.0,30+ sold recently,1 Pc USB Charging Electric Juicer 350ml Mini Portable Blender Fruit Mixers Fruit Extractors Multifunction Juice Maker Machine Blender Smoothies Mixer
Unknown,Unknown,Unknown,Unknown,5.0,0.0,1.7k+ sold recently,Rechargeable Handheld Mini Fan Small Desk Cooler Portable Air Conditioner Student Cute Mini Electric Fan Handheld Mute  Aire Aconditionado
Unknown,Unknown,#6 Best Sellers,in Ultrasonic Cleaners,7.8,0.0,Unknown,"Jewelry Cleaner Machine,Ultrasonic Jewelry Cleaner Machine Low Noise Ultrasound Silver Jewelry Cleaner For Retainer,Eyeglass,Watches,Coins,Dentures … …"
Unknown,Unknown,Unknown,Unknown,38.1,8.0,Unknown,"Electric Toothbrush For Adults,  Toothbrush With 3 Modes, USB Rechargeable Electric Toothbrush With 4 Brush Heads & 31,000 VPM Deep Clean Waterproof IPX7-White"
Unknown,Unknown,Unknown,Unknown,1.3,0.0,100+ sold recently,1pc Stainless Steel Whisk
Unknown,Unknown,Unknown,Unknown,4.2,0.0,1.9k+ sold recently,"1 Pocket Foldable Handheld Electric Fan, Rechargeable, Foldable, Handheld Small Fan, Portable Fan, Mini Handheld Fan, USB Handheld Small Pocket Fan"
Unknown,Unknown,Unknown,Unknown,6.2,0.0,300+ sold recently,1pc Portable Digital Kitchen Scale
Unknown,Unknown,Unknown,Unknown,11.3,0.0,400+ sold recently,"1pc Planet Humidifier Light, 3 Color LED Humidifier For Home Decor"
Unknown,Unknown,#3 Best Sellers,in Hair Clippers,11.9,0.0,Unknown,"Professional Barber Hair Clipper, Rechargeable Electric Cutting Machine Beard Trimmer Shaver Razor For Men Cutter"
Unknown,Unknown,#3 Best Sellers,in Electric Hair Brushes,9.3,0.0,Unknown,"1pc 28mm Plastic Spiral Curling Iron, Modern Two Tone Hair Curler For Home"
Unknown,Unknown,Unknown,Unknown,15.44,31.0,1.4k+ sold recently,"1pc 120ML Steamer For Clothes, Portable Handheld Steam Iron, 6 Round Steam Vent For 30 Minutes Of Continuous Steaming, Fabric Wrinkle Remover Steam Iron For Home, Office And Travel"
Unknown,Unknown,Unknown,Unknown,7.6,0.0,50+ sold recently,"Electric milk frother Handheld Milk Frother Mini Foamer - Mini Drink Mixer for Hot Coffee, Electric Whisk With Stand, Coffee Mixer Wand, Drink Mixer Handheld for Lattes, Cappuccino"
Unknown,Unknown,Unknown,Unknown,8.3,0.0,200+ sold recently,"Mini Cartoon Bird Design Onion Humidifier, 300ml, Home/office/desktop Air Conditioning Room Moisturizing Device"
Unknown,Unknown,#7 Best Sellers,in Kitchen Meat Grinders,33.3,0.0,Unknown,"5L Stainless Steel Electric Cooking Machine with 6-Leaf Pure Steel Knife - Fast Meat Mincer, Chopper, Garlic Mud Maker, Food Supplement, Juice and Noodle Machine - Multi-Purpose Kitchen Appliance"
Unknown,Unknown,Unknown,Unknown,15.5,3.0,100+ sold recently,"1pc Usb Rechargeable Led Display Halter Fan, Portable Bladeless Turbine Silent Slouchy Neck Fan"
Unknown,Unknown,Unknown,Unknown,27.99,60.0,200+ sold recently,"Yabano Sandwich Maker, Waffle Maker, Toaster and Electric Panini Press Grill with Non-stick Coating Plate, Easy to Clean, Heating Up Fast, Black"
Unknown,Unknown,#7 Best Sellers,in Women Shave & Hair Removal Appliances,10.44,10.0,Unknown,"Rechargeable 4-In-1 Electric Razor For Women - Painless Hair Trimmer For Face, Nose, Eyebrows, Beard, Mustache, Arm, Leg, Armpit, And Bikini - Portable Body Shavers Set Rechargeable Grooming Kit Perfect Personal Care Tool"
Unknown,Unknown,Unknown,Unknown,19.8,25.0,1.0k+ sold recently,"6l Mini-Foldable Washing Machine, Bucket-Type, Portable, Fully Automatic, With Washing And Dewatering Functions (No Drainpipe)"
Unknown,Unknown,Unknown,Unknown,25.85,50.0,Unknown,"Portable Multi-Functional Food Processor-Blender With Pulse Button Design For Kitchen, Easy Operation And Better Control Of Cutting Effect, Dual Speed"
Unknown,Unknown,Unknown,Unknown,86.4,0.0,Unknown,1pc Rechargeable PQ889 Electric Shaver Mini Washable Portable Organiser 1 Hour Battery Life
Unknown,Unknown,Unknown,Unknown,5.22,20.0,Unknown,"1pc, Plug In Electric Mosquito Repellent Lamp For Household Use, Silent And Non Radiative, Electric Mosquito Catching And Repellent Device, Pest Control, Apartment Essentials, College Dorm Essentials, Household Gadgets Electric Mosquito Killer Lamp For Home Bedroom"
Unknown,Unknown,Unknown,Unknown,1.6,0.0,50+ sold recently,1pc Heart & Flower Shaped Random Egg Ring
Unknown,Unknown,Unknown,Unknown,17.4,4.0,Unknown,"1pc Rechargeable Electric Hair Shaver With 600mAh Battery, Digital Display, 5W, For Shaving The Beard, Body Hair, Underarm Hair, Nose Hair Trimming, Eyebrow Shaping, Pubic Hair Shaving, Hair Removal For Women, 5-In-1 Trimmer, Model 8308"
Unknown,Unknown,Unknown,Unknown,18.3,0.0,Unknown,Kemei-809A Professional Hair Trimmer Adjustable Electric Cord Cordless Hair Clipper For Men Haircut Machine Led Display
Unknown,Unknown,Unknown,Unknown,12.3,0.0,800+ sold recently,"1pc Intense Pulsed Neck Face  beauty instrument Firming Wrinkle Removal Tool - Heat Rejuvenation Device, Smooth And Firm Skin - Double  Reducer Slimmer Vibration Massage With 7 Color Modes For Wrinkles Appearance Remove And Skin Tightening Lifting Massager"
Unknown,Unknown,Unknown,Unknown,45.89,34.0,Unknown,"Katulan Compact Slow Juicer, Cold Press Juicer Machines with Auto-adjustable Speed for Nutrient & Vitamin Dense Fruits and Vegetables, Easy Clean Juicer"
Unknown,Unknown,Unknown,Unknown,14.5,0.0,Unknown,Ultra-Quiet Usb Charging Rechargeable Hair Beards Trimmer Kemei Km-1247 Household Cordless Electric Hair Trimmer Clipper
Unknown,Unknown,Unknown,Unknown,31.6,0.0,Unknown,"1pc 80X60cm Flannel Electric Heating Pad, Heated Blanket With 6 Temperature And 8 Time Settings, Washable And Reusable, Suitable For Full Body"
Unknown,Unknown,Unknown,Unknown,9.3,0.0,200+ sold recently,"1 Pc Rechargeable Digital Display Lint Remover, Electric Clothes Fuzz Shaver With Suction Cup For Home Use"
Unknown,Unknown,Unknown,Unknown,6.5,0.0,1.1k+ sold recently,"1PC Portable Handheld Misting Fan, Rechargeable Personal Mister Fan,Battery Operated Spray Water Mist Fan, Foldable Mini Face Steamer For Travel, Outdoors"
Unknown,Unknown,Unknown,Unknown,11.2,0.0,20+ sold recently,Electric Pepper Mill Multifunctional Household Stainless Steel Grinder Black Pepper Grinder
Unknown,Unknown,Unknown,Unknown,7.85,13.0,Unknown,"1pc, Hair Removal Ball Clothes Scraper Hair Remover Ball Hair Removal Hair Removal Small Power Shaver Ball Remover Hair Ball Trimmer Clothes Cleaning, Household Tool, Cleaning Supplies, Cleaning Tool, Apartment Essentials, College Dorm Essentials"
Unknown,Unknown,Unknown,Unknown,7.3,0.0,10+ sold recently,1pc USB Power Cord 200ML Portable Mini Aroma Diffuser 7 Colors LED Aromatherapy Diffuser Sprayer USB Aroma Essential Oil Diffuser For Home Bedroom
Unknown,Unknown,Unknown,Unknown,31.65,25.0,100+ sold recently,"1set, Electric Spin Scrubber, Cordless Electric Shower Scrubber With 8 Replacement Brush Head, 2 Adjustable Speed, Bathroom Scrub Brush, Power Bathtub Scrubber With Extension Long Handle For Bathtub,Tile, Floor, Bathtub, Bathroom Cleaning Accessories"
Unknown,Unknown,Unknown,Unknown,10.6,3.0,20+ sold recently,"Ion Hair Straightener, Electric Ion Hair Straightener, Professional Mini Hair Straightener Curler 2-In-1 Flat Iron Small Plate Straight Hair Curling Styling Tool, Professional Hairdressing Tool, Perfect For Home And Travel, Great Holiday Gift For Women - Home Hair Design Tool, Create Salon-Quality Curls And Waves"
Unknown,Unknown,Unknown,Unknown,38.5,45.0,10+ sold recently,5 In 1 Multifunctional Hair Dryer Brush 60000RPM Blow Dryer Curling Wand Hot Air Brush
Unknown,Unknown,Unknown,Unknown,1.55,50.0,30+ sold recently,"1pc Stainless Steel Whisk, Minimalist Silver Egg Beater For Kitchen"
Unknown,Unknown,Unknown,Unknown,3.2,3.0,60+ sold recently,"1pc Portable Cartoon Mini Fan - Watch Shaped With 1 AAA Dry Battery, 1 Gear For Outdoor Use"
Unknown,Unknown,Unknown,Unknown,4.38,40.0,200+ sold recently,"1pc Adult Electric Toothbrush, 3 Brush Heads, 5 Modes, Ipx7 Waterproof, Long Battery Life, Usb Charging, Portable"
Unknown,Unknown,Unknown,Unknown,16.1,0.0,10+ sold recently,"PANCERKA 1set Electric Hand Mixer, 7-Speed Hand-Held Egg Beater Whisk Breaker, Electric Mixer, Home Appliances Stirrer, Electric Food Mixers Kitchen Bowl Aid Whisk Mixing"
Unknown,Unknown,Unknown,Unknown,9.2,0.0,100+ sold recently,"LED UV Nail Lamp, Rotatable Gooseneck Flash Cure Light For Nails, Hands Free Mini Lotus Nail Light Nail Dryer With Brush Holder Quick Dry Nail Curing Lamp For Home DIY& Salon Manicure Decor"
Unknown,Unknown,#10 Best Sellers,in Electric Lunch Boxes,20.3,3.0,Unknown,"Orange Single Electric Lunch Box, Portable Car Food Warmer Bento Box, With Electric Heating And Insulation Function, For Office Worker"
Unknown,Unknown,Unknown,Unknown,4.4,10.0,400+ sold recently,"LED Travel Makeup Mirror, Lighted Compact Make Up Mirror, 2X Magnification, Handheld, Double Sided, Portable Folding Mirror For Pocket, Purse, Gift"
Unknown,Unknown,Unknown,Unknown,8.1,0.0,200+ sold recently,1PC Colorful USB Crystal Humidifier 500ml Large Capacity Air Humidifier Portable Room Office Desktop Humidifier
Unknown,Unknown,#9 Best Sellers,in Electronic Nail Art Equipment,3.5,0.0,Unknown,Portable Salon Quick Dry USB Nail Dryer Machine UV LED Nail Light For Curing All Nail Gel Rechargeable Nail Art Tools Home Use
Unknown,Unknown,Unknown,Unknown,1.9,10.0,10+ sold recently,"1pc Multi-Functional Water Hose, Suitable For Semi-Automatic Washing Machine Inlet Hose, Air Conditioner Drainage Hose And Home Drain Extension Hose, Thickened Condensation Drip Hose For Outdoor Anti-Sun Exposure, Large Diameter Flexible Pipe For Kitchen Water Connection"
Unknown,Unknown,Unknown,Unknown,10.3,0.0,1.1k+ sold recently,"Electric Meat Grinder Multifunction Food Processor, Baby Food Making, Mixing, Chopping, Crushing Garlic And Ginger Machine"
Unknown,Unknown,Unknown,Unknown,21.5,4.0,200+ sold recently,"Professional Groin&Body Manscape Trimmer For Men, Electric Ball Shaver Replaceable Ceramic Blade Groomer, Pubic Grooming Clipper Male Razor Fully Waterproof Bikini Trimmer For Women, Best Gifts For Love, Mens Grooming Kit"
Unknown,Unknown,Unknown,Unknown,4.0,7.0,Unknown,"Rechargeable Electric Nail Drill Set For Removing Acrylic Nails, Polishing Nails, Removing Dead Skin, And Nail Care For Hands And Feet"
Unknown,Unknown,#4 Best Sellers,in Electric Eyebrow Trimmer,2.66,11.0,Unknown,Electric/Battery Operated Women's Eyebrow Trimmer Shaver Hair Remover Beauty Grooming Tool
Unknown,Unknown,#9 Best Sellers,in Car Vacuum Cleaner,9.7,0.0,Unknown,Car Wireless Vacuum Cleaner Multifunctional Strong Power Suction Home Small Size Air Extraction Handheld High Power Blower
Unknown,Unknown,Unknown,Unknown,4.93,51.0,10+ sold recently,"60 Minute Visual Countdown Timer With Night Light, Suitable For Anyone's Visual Timer, Suitable For Silent Timers In Homes, Classrooms, And Kitchens  Purple"
Unknown,Unknown,Unknown,Unknown,14.85,10.0,70+ sold recently,"Electric Foot Callus Remover Kit, Rechargeable Callus Removers 3 Grinding Heads, Waterproof Foot Scrubber File, Professional Pedicure Tools Kit With LCD Display, Feet Care For Dead, Cracked Dry Skin Ideal Gift"
Unknown,Unknown,#8 Best Sellers,in Other Body Care Machines,10.0,0.0,Unknown,Electric V-Face 6 Modes 12 Levels Of Intensity Facial Lifting Device For Women Skincare Home & Travel
Unknown,Unknown,Unknown,Unknown,12.1,4.0,30+ sold recently,"1pc LED Touchscreen Makeup Mirror Rechargeable Tabletop Cosmetic Mirror With 3 Light Colors For Home, Dormitory, And Travel"
Unknown,Unknown,Unknown,Unknown,4.17,20.0,100+ sold recently,"A Battery Operated Ladies' Hair Remover, Female Electric Shaver, Lip Hair & Underarm Hair Trimmer, Private Part Intimate Hair Removal Tool, Leg Hair And Pubic Hair Clipper, New Electric Shaving Machine, Household Full Body Hair Trimmer For Underarm, Private Part And Whole Body, With Two Color Choices - Pink And White, To Protect Your Privacy And Bodily Health"
Unknown,Unknown,Unknown,Unknown,59.84,28.0,Unknown,"2 In 1 Facial Steamer With 3X Magnifying Lamp, Esthetician Steamer Professional Aromatherapy Humidifier Face Spa Mist Steam For Home Beauty Salon, Personal Skin Care Deep Cleaning"
Unknown,Unknown,Unknown,Unknown,1.9,0.0,600+ sold recently,White Hair Removal Machine Wax Heater Depilatory Epilator Wax-Melt Waxing Kit Paraffin Heater Wax Beans Bead Heating Machine (Wax Bean Color Random)
Unknown,Unknown,Unknown,Unknown,44.99,65.0,100+ sold recently,"Boriwat Back Massager With Heat, Massagers For Neck And Back, 3D Kneading Massage Pillow For Back, Neck, Shoulder, Leg Pain Relief, Gifts For Men Women Mom Dad, Stress Relax At Home Office And Car"
Unknown,Unknown,Unknown,Unknown,8.1,0.0,400+ sold recently,"1pc Usb Powered 300ml Mini Air Humidifier, Wood Grain Aroma Diffuser, Ultrasonic Fogger, Colorful Night Light, Suitable For Home Bedroom Desktop Use"
Unknown,Unknown,Unknown,Unknown,18.2,4.0,2.3k+ sold recently,1pc Foldable Foot Bath Bucket-Portable Foot Soaking Basin ForRelaxation And Pain Relief  Foot Soak Tub With Massager-Relax And Sleep Better
Unknown,Unknown,#7 Best Sellers,in Garment Steamers,26.99,55.0,Unknown,"Reemix Steamer for Clothes, Folding Handheld Design Garment Wrinkles Remover, 20g/min Strong Penetrating Steam, 25-Sec Fast Heat-up, for Home, Office and Travel"
Unknown,Unknown,Unknown,Unknown,7.8,0.0,80+ sold recently,1pc Rechargeable Portable Neck Fan - Bladeless Personal Fan For Outdoor Sports - Hands-Free Cooling Solution
Unknown,Unknown,Unknown,Unknown,25.8,0.0,200+ sold recently,"Portable Standing Oscillating Fan With 4-Level Adjustable Speed, Quiet & Rechargeable Battery Usb Powered Floor Fan, Adjustable Height Foldable Desktop Fan, Suitable For Bedroom Home Use"
Unknown,Unknown,Unknown,Unknown,6.0,3.0,100+ sold recently,"Lovely Gradient Multicolor Teddy Bear Handheld Mini Fan, Easy To Carry In Summer"
Unknown,Unknown,Unknown,Unknown,17.5,0.0,Unknown,KM-779 Kemei/KEMEI New Pushing Hair Clipper With LCD Digital Display And Fast Oil Filling Head Carving For Hair Cutting
Unknown,Unknown,#7 Best Sellers,in Power Toothbrushes,2.07,31.0,Unknown,"New Portable Aa Battery Powered Electric Toothbrush With 30s Smart Timer, Sonic Electric Toothbrush For Oral Care - Unisex - Effectively Clean Teeth And Gums, Comes With 1+6 Replacement Heads, Ultra-Soft Brush For Sensitive Teeth And Gums"
Unknown,Unknown,Unknown,Unknown,7.6,8.0,100+ sold recently,"LED Lighted Travel Makeup Mirror, 1x/2x Magnification, Compact, Portable For Handbag, Purse, Pocket, 3.5 Inch Illuminated, Folding, Handheld, 2-Sided, Round, White, Compact Mirror, Small Vanity Mirror, Living Room Home Bedroom Bathroom House Decor, Travel Stuff, Wedding, Party, Birthday, Gifts For Men Mom Dad Best Friends Teacher, New Years, Accessaries, Funny Gift"
Unknown,Unknown,Unknown,Unknown,1.94,19.0,100+ sold recently,"1pc Rechargeable Deep Tissue Muscle Handheld Percussion Massager, For Body, Back And Neck Pain, With Ultra-Compact Elegant Design, High-Torque Driven Massage Gun"
Unknown,Unknown,#9 Best Sellers,in Vacuum Food Sealers,1.45,15.0,Unknown,"5pcs Universal Food Clips, Stylish & Practical Household Sealing Clips, Keep Purchased Food Fresh & Organized, Snack Bag Sealing Machine, Kitchen Tool"
Unknown,Unknown,Unknown,Unknown,11.0,4.0,40+ sold recently,"Effortless & Sleek Hair Removal: 2-In-1 USB Rechargeable Epilator & Razor For Bikini, Face, And More"
Unknown,Unknown,Unknown,Unknown,1.62,56.0,1.2k+ sold recently,1pc Rechargeable Usb Fan Folding Handheld Portable Fan With Three Speed Settings
Unknown,Unknown,Unknown,Unknown,7.07,61.0,1.2k+ sold recently,"1pc Rechargeable Deep Tissue Muscle Handheld Percussion Massager, For Body, Back, And Neck Pain, Ultra-Compact Elegant Design, High Torque-Drive Massage Gun"
Unknown,Unknown,#2 Best Sellers,in Heater & Cooler,3.0,0.0,Unknown,"1Set Portable Handheld Fan With Hand Strap, Battery Operated, 1 Speed"
