goods-title-link--jump,goods-title-link--jump href,rank-title,rank-sub,price,discount,selling_proposition,goods-title-link
Unknown,Unknown,Unknown,Unknown,35.99,22.0,200+ sold recently,"20000mAh Camping Fan With Dual Motor , Battery Operated Fan With 4 LED Lantern, 8 Speeds Desk Fan With Remote, Portable Outdoor Fan With Hook For Tent, Power Outages, Jobsite"
Unknown,Unknown,Unknown,Unknown,16.25,5.0,20+ sold recently,"720 LCD Myofascial Gun 1200mAh USB Rechargeable Updated Myofascial Gun Muscle Relaxation Massager With 4 Massage Heads And 6 Levels Of Speed, Touch Control Button, Suitable For Office Workers For Relaxation After Exercise For Athletes And Fitness Enthusiasts"
Unknown,Unknown,Unknown,Unknown,13.6,0.0,Unknown,"1 Set, Sourdough Starter Jar For Bakery, For Sourdough Bread Baking, Sourdough Starter Kit With Date Marked Feeding Band, Thermometer, Scraper, Sourdough Container Sewn Cloth Cover & Metal Lid, Baking Accessories"
Unknown,Unknown,Unknown,Unknown,18.1,0.0,Unknown,"Manual Rotary Cheese Grater With Wide Hopper And 3 Interchangeable Blades, Kitchen Gadget For Cheese, Vegetables, Potatoes And Nuts, Vegetable Slicer, Multifunctional Fruit Slicer, Vegetable Cutter With Container, Onion Chopper With Multiple Interchangeable Blades, Home Potato Julienne Cutter"
Unknown,Unknown,Unknown,Unknown,13.64,0.0,40+ sold recently,Stovetop Espresso Cup Moka Pot - 3 Cup
Unknown,Unknown,Unknown,Unknown,15.05,50.0,20+ sold recently,"3pcs Professional Hair Clipper Set, USB Rechargeable Electric Razor Fine Cutter Beard Trimmer Razor,Barber Trimming Machine Set,Cordless Hair Cutting Machine For Men"
Unknown,Unknown,#3 Best Sellers,in Epilators,3.0,0.0,Unknown,"Portable Battery-Operated Red Hair Trimmer Electric Epilator Eyebrow Shaping Tool, Mini Facial Hair Remover, Face Shaver For Women, Using 1pc AA Battery"
Unknown,Unknown,Unknown,Unknown,4.4,4.0,200+ sold recently,"1pc Portable Handheld Fan With Rechargeable 500mah Lithium Battery, Silicon Strap, Type-C Charging Port, Cute Cartoon Design And 3-Speed Settings"
Unknown,Unknown,Unknown,Unknown,8.4,0.0,Unknown,"1pc Egg Holder, Ceramic Cute Dog Shape Novelty Container Egg Stand, For Kitchen Dinning Table"
Unknown,Unknown,Unknown,Unknown,4.8,0.0,3.7k+ sold recently,Stay Cool On-The-Go: 1pc Portable USB Mini Fan
Unknown,Unknown,Unknown,Unknown,17.99,74.0,Unknown,Handheld Massager 20 Speed Wand Vibrating Massage Magic Full Body Therapy Motor
Unknown,Unknown,Unknown,Unknown,3.26,52.0,Unknown,"5-Layer Stainless Steel Kitchen Scissors - Multifunctional Onion And Herb Chopper For BBQ And Indoor Use - Durable, Safe, With Protective Cover And Built-In Cleaner"
Unknown,Unknown,Unknown,Unknown,0.8,50.0,Unknown,"1pc Mini LED Electronic Finger Counter, Portable Buddhist Prayer Beads Counting Ring, Manual And Precise"
Unknown,Unknown,#1 Best Sellers,in Oximeter & Blood Pressure Meter,11.2,0.0,Unknown,"1pc Battery Sphygmomanometer (4 X 7 Batteries), Cuff Upper Arm Sphygmomanometer, Digital Display, Suitable For Home Use, Easy To Carry On The Go."
Unknown,Unknown,#6 Best Sellers,in Oral Care Appliances,3.4,0.0,Unknown,1pc Rechargeable/battery Operated Electric Toothbrush With 6-speed Adjustable Settings And 6 Brush Heads
Unknown,Unknown,Unknown,Unknown,2.6,10.0,30+ sold recently,Women's Lipstick Portable Electric Shaver
Unknown,Unknown,Unknown,Unknown,9.1,7.0,1.5k+ sold recently,"Usb Rechargeable Desktop Mini Fan With Telescopic Feature, Adjustable In 3 Speeds"
Unknown,Unknown,Unknown,Unknown,81.99,34.0,80+ sold recently,"HOMCOM 32"" Mobile Evaporative Air Cooler, 3-In-1 Ice Cooling Fan Water Conditioner Humidifier Unit With Remote, Timer, Oscillating, LED Display, 3.2gal Water Tank For Home Office Bedroom"
Unknown,Unknown,#8 Best Sellers,in Wax Heaters,17.3,0.0,Unknown,"Roll On Wax, Wax Roller Kit For Hair Removal, Roller Waxing Kit Include 2 Soft Wax Cartridge & 100 Non-Woven Wax Strips & 10 Wax Removing And Moisturizing Wipes, Portable Pink Wax Heater Machine For Women & Men, Waxing Roller Kit Depilatory Wax For Sensitive Skin"
Unknown,Unknown,Unknown,Unknown,15.7,0.0,10+ sold recently,"Portable Cordless Hair Straightener Brush,Portable Straightening Brush With Negative Lon,Hot Comb Hair Straightener For Women, Lightweight & Mini To Carry Out"
Unknown,Unknown,Unknown,Unknown,4.5,2.0,600+ sold recently,1pc Rechargeable Portable Handheld Single Speed Outdoor Simple Mini Fan With Lanyard
Unknown,Unknown,Unknown,Unknown,10.2,0.0,Unknown,1pc Manual Coffee/Tea Separation Brewing French Press
Unknown,Unknown,Unknown,Unknown,2.9,3.0,20+ sold recently,"All-In-One Men's Electric Shaver, Multi-Function Razor With LCD Display, USB Charging And Three Different Blades, Suitable For Car Usage"
Unknown,Unknown,Unknown,Unknown,2.6,0.0,300+ sold recently,1ps Rechargeable 10ml Intelligent Car Fragrance Machine Ultrasonic Atomization Automatic Start Stop Car Air Vent Fragrance Machine
Unknown,Unknown,Unknown,Unknown,7.6,0.0,Unknown,"1pc 3-In-1 USB Rechargeable Vacuum Sealer - Portable Electric PumpElectric Mini Vacuum Pump For Kitchen Storage, Sous Vide And Meal Preparation Preserves Fresh Food And Reduces Waste"
Unknown,Unknown,Unknown,Unknown,2.09,37.0,50+ sold recently,"1pc Little Flower Humidifier Usb Mini Portable Silent Water Cup Office Home Air Humidifier Water Mist Maker, Red Nano Steamer Facial Steamer Humidifier, Unclogs Pores Spray Facial Steamer Skin Care Tool"
Unknown,Unknown,#10 Best Sellers,in Portable Washing Machines,38.53,28.0,Unknown,"Portable Washing Machine 11L Large Capacity, Mini Foldable Washing Machine With Spin Dryer, Small Collapsible Laundry Washer For Travel, Apartment, Underwears, Socks, Baby Clothes (Purple)"
Unknown,Unknown,Unknown,Unknown,11.3,0.0,400+ sold recently,"GW Hair Dryer Salon Performance AC Motor Styling Tool/Hair Dryer Professional Blow Dryer Fast Drying For Hair Care / 2 Speed/Cold, For Home Travel Hotel"
Unknown,Unknown,Unknown,Unknown,6.2,0.0,Unknown,"1pc Household Electronic Kitchen Scale, Mini Baking Scale, Small Food Scale, Digital Weight Scale, Kitchen Weighing Scale (In Kilograms),Kitchen,Party,Camping,Room Decor,Kitchen Items,Kitchen Portable."
Unknown,Unknown,Unknown,Unknown,17.99,5.0,20+ sold recently,MACchine Electric Pulse Massager Muscle Stimulator Pain Relief Therapy
Unknown,Unknown,Unknown,Unknown,14.09,19.0,Unknown,"Body Hair Trimmer For Men, Electric Ball Trimmer Men, Groin Shaver For Men, Pubic Hair Groomer, Wet Dry Grooming Machine, Replaceable Ceramic Male Hygiene Razor For Full Body Grooming, Professional Cordless Hair Cutting Clippers"
Unknown,Unknown,Unknown,Unknown,12.3,12.0,Unknown,1pc Juicer Portable Small Charging Juicer Cup Household Customization Multifunctional Juicer Juicer Cup
Unknown,Unknown,Unknown,Unknown,13.35,46.0,Unknown,"1pc Wall Plug Mobile Range Hood,3-Gears"
Unknown,Unknown,Unknown,Unknown,14.2,0.0,50+ sold recently,"Desktop Fan Cooling Air Conditioner Small Size USB Powered, Silent Fan Bedroom Dormitory Office Cooling Artifact Mini Air Conditioner New Style Oscillating Large Wind Force Silent Room"
Unknown,Unknown,Unknown,Unknown,44.48,28.0,Unknown,"1PC Compact Multi-Function Refrigerator For Skincare/Cosmetics, Food And Beverages, Portable Mini Fridge For Car And Home"
Unknown,Unknown,Unknown,Unknown,8.8,0.0,10+ sold recently,"Electronic Acupuncture Pen, Acupressure Therapy Pen, Intelligent Meridian Massager, Muscle Relief Massage Pen"
Unknown,Unknown,Unknown,Unknown,3.4,6.0,200+ sold recently,"5 In 1 Women'S Electric Hair Removal Epilator Trimmer For Bikini, Eyebrow, Beard, No Battery Included Electric Hair Depilator"
Unknown,Unknown,Unknown,Unknown,7.6,12.0,10+ sold recently,"1pc Retractable Foldable Desktop Fan, USB Powered, 6 Inches, Quiet, For Office Desk"
Unknown,Unknown,Unknown,Unknown,2.07,31.0,300+ sold recently,"New Portable Battery-Operated Electric Toothbrush With 30 Second Timer, Sonic Electric Toothbrush For Oral Health - Suitable For Both Men And Women - Effectively Clean Teeth And Gums, Comes With 1 Handle And 6 Replacement Brush Heads, Ultra Soft Bristles For Sensitive Teeth And Gums"
Unknown,Unknown,Unknown,Unknown,3.06,10.0,300+ sold recently,"1pc Cat Design Electric Fan, Pink Small Handheld Fan For Outdoor"
Unknown,Unknown,#5 Best Sellers,in Curling Tongs & Curling Wands,13.5,4.0,Unknown,"Multifunctional Curling Iron Hair Curling Wands Electric Fast Heating Hair Curling Iron Anti Scalding Design Hair Styling Tools (0.35IN,0.51IN,0.86IN,0.98IN,1.10IN,1.25IN) Mother's Day Gift"
Unknown,Unknown,Unknown,Unknown,4.0,0.0,Unknown,Painless And Safe USB Rechargeable Electric Hair Removal For Women - Full Body Shaver With Lipstick Shape
Unknown,Unknown,#7 Best Sellers,in Car Vacuum Cleaner,23.7,0.0,Unknown,Black Wired Car Vacuum Cleaner With Storage Bag
Unknown,Unknown,Unknown,Unknown,14.94,55.0,Unknown,"Upgrade Your Kitchen With This Rechargeable Electric Pepper Grinder Set - Automatic, Adjustable, Dustproof, And LED Light!"
Unknown,Unknown,Unknown,Unknown,3.5,0.0,300+ sold recently,"1pc Mini USB Rechargeable Fan, Suitable For Home & Outdoor Use"
Unknown,Unknown,Unknown,Unknown,5.8,0.0,Unknown,"1 Set Of 2 Batteries, Size 5, Mini Electric Blackhead Remover, Blackhead Remover, Pore Cleaner, 3 Types Of Suction Heads, 2 Levels Of Adjustable Strength, Facial Cleaning, Black Small Particles, Acne, And Blackheads, Keeping The Face Clean And Refreshing"
Unknown,Unknown,Unknown,Unknown,11.0,0.0,200+ sold recently,"Professional Hair Trimmer Set Hair Clippers Cordless Hair Trimmer Electric Barber Clippers Zero Gapped Trimmer Professional Beard Trimmer Rechargeable Hair Cutting Kit , Gift Set"
Unknown,Unknown,#5 Best Sellers,in Temperature Gauges,8.87,27.0,Unknown,"1pc 12inches Sun Metal Thermometer, Four Seasons Garden Decor Golden Decor Battery Free Decor Thermometer, Festival Gift&Home, For Outdoor, Porch, Foyer, Living Room, Fence"
Unknown,Unknown,Unknown,Unknown,5.2,0.0,Unknown,"1 Set 3-In-1 Vacuum Food Sealer, Save Sealer, USB Rechargeable Handheld Pump, For Sous Vide And Food Storage, With 10 Reusable Zipper Vacuum Bags, Compatible With Anova Joule Sous Vide Machine"
Unknown,Unknown,Unknown,Unknown,2.96,56.0,90+ sold recently,1pc 7 Steel Ball Abdominal Massager| Handheld Ball Massager Beauty Meridian Brush Kneads Abdomen Slender Waist Beautiful Legs Muscle Relaxation
Unknown,Unknown,Unknown,Unknown,2.9,3.0,80+ sold recently,Hair Clipper Electric Pusher Haircut Machine Electric Clipper Oil Head Carving Razor For Bald Head Haircut
Unknown,Unknown,Unknown,Unknown,23.6,4.0,30+ sold recently,"Steam Hair Straightener Flat Iron Professional Ceramic Tourmaline 2-In-1 Straightening Iron, Adjustable 300-450F Salon Heat,  Dual Voltage, Black"
Unknown,Unknown,Unknown,Unknown,71.99,45.0,30+ sold recently,"Havato Nugget Ice Maker Countertop,  Self-Cleaning  Ice Maker With Ice Basket & Scoop, 26Lbs/24H, 9 Ice Cubes Ready In 6 Mins, Chewable Ice Maker Machine For Home Camping Party RV"
Unknown,Unknown,Unknown,Unknown,10.9,4.0,40+ sold recently,"Hair Clipper For Men, Hair Cutting Machine, Beard Trimmer ,Cordless Barber Clipper With LED Display"
Unknown,Unknown,Unknown,Unknown,6.1,0.0,80+ sold recently,Portable Wireless EMS Home Fitness Massage Trainer For 1pc Arm And 1pc Abdomen (With 2pcs Hosts Without Battery)
Unknown,Unknown,Unknown,Unknown,9.9,0.0,10+ sold recently,"1 Handheld Fan, 2000mAh Power Bank, Small Flashlight, Pocket Fan, Portable Battery Powered Or USB Powered Foldable Personal Fan, 3-Speed, Female Gift, Male Gift, Children's Holiday Gift"
Unknown,Unknown,#5 Best Sellers,in Electric Lunch Boxes,18.24,40.0,Unknown,"A 1.5 Liter Portable Heating And Thermal Insulation Lunch Box, Lunch Box Kids,Lunch Box Men,Lunch Box Insulated,Lunch Box Electric,Lunch Box Women,Lunch Box For Boys,Lunch Box Girls,Lunch Box For Women,Lunch Box Containers,Lunch Box For Men,Bento Box For Kids,Bento Box Stainless,Bento Box With ,Bento Box With Bag,Bento Box With Utensils,Bento Box Office,Bento Box Food,Bento Box Portable,Bento Box Handle,Bento Box Dividers,Bento Box Lunch,Bento Box Kitchen,Bento Box Camping Bag,Bento Box O"
Unknown,Unknown,Unknown,Unknown,1.86,40.0,10+ sold recently,"1pc Kitchen Timer, Digital Countdown Timer, Stand Timer, Cooking Timer, No Battery Needed, Teacher Timer, Easy-To-Use Timer, Kitchen Accessory, Dorm Essential, Small Kitchen Tool."
Unknown,Unknown,#5 Best Sellers,in Hair Straightening Irons,11.0,4.0,Unknown,"Ceramic Automatic Hair Straightener 320'F- 428'F Temperature, For AllHairstyles Straightener Fast Heating Multifunctional Hair StraightenerHair Styling Tool For Dry Or Wet Hair(US)"
Unknown,Unknown,Unknown,Unknown,7.6,4.0,100+ sold recently,"Led Makeup Mirror With Light Desktop Stand, Portable Cosmetic Mirror With Light"
Unknown,Unknown,Unknown,Unknown,27.99,47.0,100+ sold recently,"Portable Blender,Christmas Gift Shakes And Smoothies Waterproof Blender USB Rechargeable With 20 Oz Blender Cups With Travel Lid."
Unknown,Unknown,Unknown,Unknown,17.1,10.0,500+ sold recently,"Rechargeable Hair Trimmer For Split Ends, Portable Electric Automatic Haircut Machine For Household Use Gift"
Unknown,Unknown,Unknown,Unknown,2.15,40.0,400+ sold recently,"Turbo Mini Fan, Handheld & Desktop Stand Dual Use, Powerful Wind"
Unknown,Unknown,Unknown,Unknown,19.3,0.0,30+ sold recently,"1pc Portable ABS Beauty Machine, Modern 7 Color Light Led Wrinkle Tighten Skin Care Beauty Machine For Home"
Unknown,Unknown,Unknown,Unknown,36.4,0.0,40+ sold recently,"Portable Air Conditioner,Cooler,Desktop Fan USB Electric Fan Telescopic Folding Small Fan USB Charging Student Dormitory Office Desktop Mute Large Fan"
Unknown,Unknown,Unknown,Unknown,4.0,0.0,200+ sold recently,10pcs Self Adhesive 3.5mm Electrode Pads 5.5x8cm Replacement Gel Pads TENS EMS Massage Pad For Pulse Massager Muscle Stimulator
Unknown,Unknown,Unknown,Unknown,3.5,8.0,20+ sold recently,1pc USB Fan Mini Portable Desktop Fan Quiet Office Fan With Multi-Angle 3D Cooling Handheld Fan Air Conditioner Cooler Gift For Students Or Home Use In Summer
Unknown,Unknown,Unknown,Unknown,8.69,14.0,100+ sold recently,"4d Multifunctional Electric Shaver, Rechargeable, Waterproof, Electric Head Hair Shaver Men's Beard Trimming Tool"
Unknown,Unknown,Unknown,Unknown,3.2,0.0,3.5k+ sold recently,Hair Clipper Electric Pusher Haircut Machine Electric Clipper Oil Head Carving Razor For Bald Head Haircut
Unknown,Unknown,Unknown,Unknown,1.6,0.0,10+ sold recently,"1pc/3pcs/6pcs Silicone Sealing Ring O-Ring 600W/900W Juice Extractor Blender Accessory Nutriblender Replacement Part,Kitchen Portable Fruit Machine,Portable Juicer And Blender,Juice,Lemon."
Unknown,Unknown,Unknown,Unknown,13.5,0.0,Unknown,"1pc 7 Colors Flame Simulation Ultrasonic Humidifier With Aromatherapy And Lighting - USB Powered Essential Oil Diffuser For Bedroom And Travel ,H2o Air Fire Flame Humidifier  Oil Diffuser Humidifier School Supplies, Back To School"
Unknown,Unknown,Unknown,Unknown,55.99,44.0,Unknown,"IPL Hair Removal For Women At-Home,Upgraded To 999,000 Flashes Painless Hair Remover,Facial Hair Removal Device For Armpits Legs Arms Bikini Line"
Unknown,Unknown,Unknown,Unknown,7.6,0.0,20+ sold recently,Mini Lightweight Portable Full Body Electric Massager
Unknown,Unknown,Unknown,Unknown,5.52,40.0,Unknown,Kitchen Scale Mini Household Weight Scale Baking Food Scale Electronic Kitchen Scale
Unknown,Unknown,Unknown,Unknown,2.9,0.0,300+ sold recently,"1 Unit, USB Data Cable Power Supply 220ml Ultrasonic Mini Air Humidifier Aromatic Diffuser Household Car Office Humidifier With LED Night Light Freshener Product Size: Height 4.05in * Width 3.14in"
Unknown,Unknown,Unknown,Unknown,6.9,4.0,200+ sold recently,"Electric Trimmer For Removing Lip Hair, Nose Hair, Underarm, And Private Parts For Both Men And Women"
Unknown,Unknown,Unknown,Unknown,16.1,0.0,10+ sold recently,"300ml Aroma Diffuser For Essential Oil Large Room, Ultrasonic Humidifier With 8 Color Lights, 3 Timer Setting, Auto Shut-Off"
Unknown,Unknown,Unknown,Unknown,6.4,0.0,20+ sold recently,"Mini Electric Lint Remover, Battery-Operated Fabric Shaver"
Unknown,Unknown,Unknown,Unknown,4.5,4.0,1.5k+ sold recently,1pc Rechargeable Portable Handheld Heart Shaped Fruit Fan With Cellphone Holder Function
Unknown,Unknown,#2 Best Sellers,in Electric Shavers,7.33,42.0,Unknown,Professional Mens Hair Clippers Zero Gapped Cordless Hair Trimmer Professional Haircut & Grooming Kit For Men Rechargeable LED Display
Unknown,Unknown,Unknown,Unknown,15.6,9.0,Unknown,"New Arrival Electric Handheld Massage Hammer With Vibration & Kneading Function, Cordless Design"
Unknown,Unknown,Unknown,Unknown,2.0,0.0,Unknown,1pc Cartoon Mini Portable Bear Calculator With LED Large Screen Display Creative Keychain Calculator
Unknown,Unknown,#9 Best Sellers,in Electric Grills & Electric Griddles,81.99,20.0,Unknown,"VEVOR 14"" 1500W Electric Countertop Flat Top Griddle 110V Non-Stick Commercial Electric Griddles Restaurant Teppanyaki Grill Stainless Steel Adjustable Temperature Control 122°F-572°F, Sliver"
Unknown,Unknown,Unknown,Unknown,3.0,0.0,100+ sold recently,"1pc Portable Handheld Fan With Hand Rope, Battery Operated (Batteries Not Included), 1 Speed Level"
Unknown,Unknown,Unknown,Unknown,9.1,3.0,Unknown,"1pc, Dual Power Supply (Plug-In And Battery), LED Double-Sided Foldable Makeup Mirror, Requires 4 AAA Batteries, 10x Magnifying Mirror On Both Sides, Desktop Vanity Light, With Lipstick Storage"
Unknown,Unknown,Unknown,Unknown,17.1,0.0,Unknown,"1pc+Type-C USB+4000mAh+5V/2A+Emergency Power Bank Function+Digital Display+Portable+Folding+Desktop, Neck Hanging, Upright, Handheld Cooling Fan+5-Speed Strong Wind+H08+Brushless Motor Mini Fan"
Unknown,Unknown,Unknown,Unknown,13.0,0.0,Unknown,1pc Planet Design Humidifier
Unknown,Unknown,Unknown,Unknown,23.99,40.0,40+ sold recently,"Neck Fan, 4 Turbos Foldable Portable Fan, 6000mAh Bladeless Neck Fan Rechargeable, LED Display, 3 Speeds Adjustment, 360°Cooling Airflow For Office, Outdoor, Travel, Home"
Unknown,Unknown,Unknown,Unknown,10.1,0.0,100+ sold recently,"Portable Fan, Handheld Fan Personal Mini Fan 3000mAh Rechargeable With 5 Speeds, Battery Operated Mini Fan With LED Display, 11-21Hs Desk Fan Working Time For Office Bedroom Outdoor Travel Camping"
Unknown,Unknown,#6 Best Sellers,in Water Filter Cartridges,4.47,16.0,Unknown,"6pcs/Set Faucet Water Filter ,  Water Purification, Faucet Multi -Function Filtration, Enjoy Clean Water, Malls Hotels Home Outdoor RV Universal Model Replaceable Filter, For Hotel Restaurant Purified Water"
Unknown,Unknown,Unknown,Unknown,11.0,0.0,Unknown,EMS  Massage Device Muscle Training Device  Massage  Belt Abdomen Waist Instrument Smart Sculpting Abdomen Belt
Unknown,Unknown,#2 Best Sellers,in Vacuum Cleaners,21.2,0.0,Unknown,"1pc Multifunctional High Power Home Car Vacuum Cleaner With Inflator, Wireless Tyre Inflator, Portable Pet  Vacuum Cleaner For Car & Home Use"
Unknown,Unknown,Unknown,Unknown,12.5,0.0,Unknown,"Stainless Steel Cold Water Pitcher, European Style For Home, Restaurant Or Hotel. It Is Suitable As A Gift For Business Opening. Please Do Not Use It To Boil Water."
Unknown,Unknown,Unknown,Unknown,12.2,28.0,Unknown,Smart Watch Health Monitoring Bluetooth Call Watch Exercise Heart Rate Blood Oxygen
Unknown,Unknown,Unknown,Unknown,8.55,10.0,Unknown,"Electric Wine Decanter, Quick Intelligent Wine Pourer, With An Automatic One-Click Dispenser And A Second Press Stopper. Built-In Air Intake To Simultaneously Air The Wine While Pouring, Saving 15-20 Minutes. Fully Charged, It Can Pour Above 30 Bottles Of Red Wine."
Unknown,Unknown,Unknown,Unknown,18.9,4.0,80+ sold recently,"1pc New Automatic Hair Trimmer, Hair Clippers, Unisex Grooming, Portable Hair Shaver With Blue Light Hair Care Function, Surprise Gift For Women's Festival"
Unknown,Unknown,Unknown,Unknown,5.76,37.0,80+ sold recently,Fascia Gun Muscle Massager Portable Fitness Muscle Relaxer Exercise Recovery Mini Electric Massage Gun
Unknown,Unknown,Unknown,Unknown,21.22,32.0,60+ sold recently,Desktop Cooling Fan USB Office Home Desktop Spray Water Cooler Mini Air Conditioning Fan
Unknown,Unknown,Unknown,Unknown,14.2,0.0,Unknown,Electric Makeup Brush Cleaner And Dryer - Quick And Easy Cleaning And Drying In One Minute - 8 Rubber Tube Sleeves For Optimal Brush Care
Unknown,Unknown,Unknown,Unknown,4.9,0.0,90+ sold recently,"Portable Handheld Fan With Desktop Base, 3 Adjustable Speeds, Rechargeable Battery, Mini Usb Fan For Office/Travel/Outdoor/Camping/Reading, Grey"
Unknown,Unknown,Unknown,Unknown,14.1,3.0,200+ sold recently,Professional Hair Curling Iron Ceramic Triple Barrel Hair Curler Irons Hair Wave Waver Styling Tools Hair Styler Wand Heated Styling Iron Brush Fast Heating Hair Wand Curler In All Hair Type
Unknown,Unknown,Unknown,Unknown,14.2,16.0,200+ sold recently,"Pink Set Generation 2 Rechargeable Hair Trimmer, Split Ends Hair Cutter, Household 2-In-1 Portable Hair Clippers, Electric Hair Cutting Tool With Hair Clipper"
Unknown,Unknown,Unknown,Unknown,6.4,0.0,Unknown,1pc Stainless Steel Visual Kitchen Timer With Magnetic Back Countdown Reminder For Cooking Baking Alarm Clock
Unknown,Unknown,Unknown,Unknown,4.8,50.0,10+ sold recently,"1PC Portable Wireless Handheld Car Vacuum Cleaner, Mini, For Home And Car Use"
Unknown,Unknown,#3 Best Sellers,in Hair Straightening Irons,28.6,0.0,Unknown,"angenil Argan Oil Flat Iron Curling Iron In One, Professional Portable Dual Voltage Ceramic Hair Straightener, 1.6 Inch Wide Flat Iron For Thick Hair, Fast Straightening Styling, Lcd Display"
Unknown,Unknown,Unknown,Unknown,10.6,20.0,80+ sold recently,"Powerful Portable Electric Food Chopper & Processor Made Of 304 Stainless Steel - Mini Usb Wireless Handheld Garlic Slicer With 350ml Capacity, Made Of Plastic, Suitable For Vegetables & Meat"
Unknown,Unknown,#7 Best Sellers,in Meat Grinders,34.8,0.0,Unknown,"4-In-1 Handheld Blender Set, Including Multi-Function Stick Blender, Whisk, Chopper And Beaker, Suitable For Food Processing & Baby Food Mixing"
Unknown,Unknown,Unknown,Unknown,7.41,22.0,100+ sold recently,"Women'S Depilator Shaver For Leg, Body, Face, Bikini Line Trimming, Electric Hair Depilator Wet And Dry Use Home Use Shaver Tool"
Unknown,Unknown,Unknown,Unknown,7.6,50.0,Unknown,"1pc Yunbaoit Rainbow Visual Timer - 60 Min Countdown, Night Light, Whisper-Quiet, Classroom & Kitchen Timer For Home, School & Office"
Unknown,Unknown,Unknown,Unknown,24.3,2.0,20+ sold recently,5in1 Multifunctional Hot Airbrush Curling & Straightening Ionizing Hair Dryer For Styling
Unknown,Unknown,Unknown,Unknown,9.4,4.0,300+ sold recently,"Multifunctional Electric Shaver For Men, With Razor, Hair Clipper,Rechargeable Hair Clipper Trimmer Kit Digital Display Men's Trimmer Men's Trimmer Shaver Portable Haircut Machine For Man, Mens Grooming Kit"
Unknown,Unknown,Unknown,Unknown,11.3,0.0,30+ sold recently,"1pc Rechargeable 1800mAh Outdoor Portable Mini Fan With Neck Lanyard, Waist Clip & Table Stand, 5 Speeds, Natural Wind, Power Display, With Hanging Rope"
Unknown,Unknown,Unknown,Unknown,8.1,5.0,Unknown,"A Type-C Rechargeable Handheld Fan With 5-Speed Level LED Display, 180° Foldable & 5-Blade High Velocity Fan. Choose From Three Colors."
Unknown,Unknown,Unknown,Unknown,24.1,5.0,20+ sold recently,"Foot Grinder, Electric Callus Remover, Foot File Grinder Pedicure Tool With Speed Controller And 20pcs Replacement Sandpaper Disk For Men Women Dead Dry Crack Skin Calluses"
Unknown,Unknown,Unknown,Unknown,3.7,0.0,Unknown,"Compact UV LED Nail Lamp: Hypoallergenic, USB-Powered, Fast-Drying & Portable For On-The-Go Manicures, With Rechargeable Lithium Battery"
Unknown,Unknown,Unknown,Unknown,10.0,0.0,20+ sold recently,"K26 Cute Cartoon Neck-Hanging Fan, Portable, 3-Speed, Strong Wind, Long-Lasting, Lightweight, Rechargeable, For Outdoor Activities, Hand-Held, Dormitory, And Office Creative Gift"
Unknown,Unknown,Unknown,Unknown,18.24,40.0,Unknown,Black Electric Coffee Grinder
Unknown,Unknown,Unknown,Unknown,18.45,10.0,50+ sold recently,Multi-Functional Juicer Household Automatic Juicer Separation Small Portable Orange Juice Cup USB Charging
Unknown,Unknown,Unknown,Unknown,9.6,0.0,200+ sold recently,Household Kitchen Scale Stainless Steel Weighing Scale For Food Diet Balance Measuring LCD Precision Electronic Scales 10Kg
Unknown,Unknown,Unknown,Unknown,26.89,0.0,10+ sold recently,"Toaster 2 Slice, Extra Wide Slot, Stainless Steel, 7 Browning Shade Settings, Bagel/Gluten-Free/Reheat Function, Variable Browning Control, 900 Watt"
Unknown,Unknown,Unknown,Unknown,30.6,4.0,100+ sold recently,Largner Professional Hair Clippers For Men- Hair Cutting Kit & Zero Gap T-Blade Trimmer Combo- Cordless Barber Clipper Set With Led Display For Mens Gifts(Black)
Unknown,Unknown,Unknown,Unknown,24.0,4.0,20+ sold recently,"Automatic Hair Curler, Ceramic Ionic Barrel Automatic Hair Curling Iron, Auto Curling Wand With 1"" Large Rotating Barrel & 4 Temps & 3 Timer Settings, Dual Voltage Spin Iron For Hair Styling"
Unknown,Unknown,Unknown,Unknown,7.8,36.0,100+ sold recently,"Hair Curling Comb Electric Curler Professional Styling Tools Hot Comb Hair Straightener Brush For All Hair Types, Green, Purple, Valentines Day, St Patrick Day, Mother's Day Gift 110V"
Unknown,Unknown,Unknown,Unknown,25.49,35.0,Unknown,"Teckwe Hair Straightener,Beauty Heating Salon Flat Iron,Quick Warm-Up & LCD Display,Long-Lasting Hold And Smooth Hair & 1h Smart Shut Down For Home Travel - US Plug"
Unknown,Unknown,Unknown,Unknown,6.1,5.0,50+ sold recently,LARGNER Men Electric Shaver 3D Floating Razor Washable Rechargeable Electric Razor Triple Blade Beard Trimmer Whole Body Wash USB Travel Charger - Perfect Gift For Boyfriend Or Father
Unknown,Unknown,Unknown,Unknown,9.7,0.0,10+ sold recently,Pink Electric Massage Gun For Relieving Muscle Stiffness And Soreness
Unknown,Unknown,Unknown,Unknown,25.9,0.0,70+ sold recently,"1pc PP Food Mixer, Multifunctional Household Hand Mixer For Kitchen"
