goods-title-link--jump,goods-title-link--jump href,rank-title,rank-sub,price,discount,selling_proposition,goods-title-link
Unknown,Unknown,Unknown,Unknown,6.4,4.0,Unknown,Kemei Mini Hair Trimmer Portable Hair Clipper Hair Cutting Machine For Travel Or Home Use AA Battery Trimmer Machine For Men KM-666
Unknown,Unknown,Unknown,Unknown,7.3,0.0,Unknown,Kemei KM-666 Wholesale Mini Dry Battery Hair Clipper Portable Hair Trimmer Wholesale Hair Cut Trimmer
Unknown,Unknown,Unknown,Unknown,7.3,0.0,Unknown,Boys And Girls Universal LED Four Kinds Of Lighting High-Definition Makeup Mirror Can Adjust The Angle Of Comfort Dormitory And Home Portable Simple Style Makeup Mirror
Unknown,Unknown,Unknown,Unknown,65.54,28.0,Unknown,"EVELYN Smart Shot Intelligent High Speed Negative Ionic Hair Dryer With Diffuser - Hot/Cool Blast And Ionic Frizz Control, Fast Drying Blow Dryer With 110000 RPM Motor - 4 Temps & 2 Speeds, Black"
Unknown,Unknown,Unknown,Unknown,6.6,0.0,Unknown,"1pc New USB Handheld Fan Mini Portable Student Fan With Folding Display & Aroma Feature, Gift Boxed With Base, Lanyard & Charging Cable"
Unknown,Unknown,Unknown,Unknown,25.5,0.0,Unknown,Camping Fan With LED Lantern 4000mAh Portable Tent Fan Power Supply Personal Fan Lantern For Tent RV Hurricane Emergency Outages
Unknown,Unknown,Unknown,Unknown,5.5,0.0,Unknown,"1pc Best-Selling Mini Pocket Fan Portable Battery Quiet Small Fresh Handheld Small Fan,Dormitory Desktop Fan, Pocket Square Fan, Gift For Family And Friends"
Unknown,Unknown,Unknown,Unknown,6.1,0.0,Unknown,"1pc Handheld Fan USB Rechargeable Portable Mini Fan, Foldable, Suitable For Indoor & Outdoor, Cute Design, Perfect For Outdoor Activities, School, Beach, Pool, Party, Office, Daily Life Use, Summer"
Unknown,Unknown,Unknown,Unknown,17.7,0.0,Unknown,"Portable Camping Fan Rechargeable, 7800mAh Battery Powered Fan With LED Lantern Small Table Fan, USB Battery Operated Fans For Travel Tent Office Desk Barbecue Fishing"
Unknown,Unknown,Unknown,Unknown,17.14,28.0,Unknown,"Thermal Brush, 1.25 Inch Curling Brush Curling Iron 410°F Ceramic Tourmaline 110-240V Voltage Double PTC Heater Volumizing Brush Styler Head With For Travel Heated Round Brush"
Unknown,Unknown,Unknown,Unknown,19.1,0.0,Unknown,"Neck Fan, Rechargeable Portable Neck Fan, 5200mAh Battery Powered Bladeless Cooling Fan, 4-Speed Wearable Hands-Free Personal Fan, 360°C Cooling Airflow Hanging Neck Fan For Men, Women"
Unknown,Unknown,Unknown,Unknown,9.7,0.0,Unknown,"Car Vacuum Cleaner 2500pa Handheld USB Charging Dual-Use Portable Multifunctional Cleaner For Home And Car, Including Blowing And Suction Function"
Unknown,Unknown,Unknown,Unknown,9.4,0.0,Unknown,"1 Pc Summer Watch Handheld Fan, 3-Speed Silent USB Rechargeable, Watch Fan Portable Quiet Small Fresh Handheld Small Fan"
Unknown,Unknown,Unknown,Unknown,25.69,28.0,Unknown,"Rechargeable Desk Fan With Tripod, Camping Fan Battery Powered Table Fan, Personal Mini Fan, 4-Speed 360° Vertical Rotatable Portable USB Fan, Silent, For Bedroom, Office, Desktop And Travel (White)"
Unknown,Unknown,Unknown,Unknown,10.0,0.0,Unknown,"1pc Creative New Item 1.5L Manual Vegetable Chopper And Meat Grinder, Household Hand-Operated Meat Mincer"
Unknown,Unknown,Unknown,Unknown,7.2,0.0,Unknown,"1pc Mini USB Charging Collar, Handheld, Astronaut Leafless Astronaut Electric Fan, A Good Helper For Summer Outing"
Unknown,Unknown,Unknown,Unknown,35.9,4.0,Unknown,"Vanity Mirror With Lights, 1X/10X Magnifying Makeup 8 Inch Rechargeable Double Sided Lighted Mirror, Dimmable Led 3 Color Lighting Modes"
Unknown,Unknown,Unknown,Unknown,22.9,4.0,Unknown,"Electric Razor Shaver, Beard Trimmer Hair Trimmer Shaving Kit, Foil Shaver Barber Clipper For Men, Men's Grooming Kit, Holiday Gifts For Him"
Unknown,Unknown,Unknown,Unknown,34.22,28.0,Unknown,"Steam Iron With Rapid Heating Soleplate, With Precise Thermostat Dial, Auto-Off, For Home Clothes Ironing Use, Electric Iron Blue"
Unknown,Unknown,Unknown,Unknown,8.1,0.0,Unknown,"1 PP Material Kitchen Four Grid Egg Cooker Cute Chicken Model Microwave Oven Egg Cooker Egg Steamer Boiler Stove, Suitable For Household Use Of Steaming And Cooking"
Unknown,Unknown,Unknown,Unknown,7.3,50.0,Unknown,"Rechargeable Men's Electric Shaver, 2-In-1 Wet & Dry Men's Electric Razor, Beard Trimmer, Rotary Shaver, Father's Day Gift"
Unknown,Unknown,Unknown,Unknown,9.6,4.0,Unknown,Electric Cordless Professional Hair Clippers Kemei Km-1256 High Quality Usb Barber Waterproof Cordless Hair Trimmer
Unknown,Unknown,Unknown,Unknown,34.26,28.0,Unknown,"Juicer Machines, SiFENE Compact Centrifugal Juicer Extractor, Juice Maker For Vegetable And Fruit With 3-Speed Setting, Easy To Clean, Black"
Unknown,Unknown,Unknown,Unknown,19.15,28.0,Unknown,"Thermal Brush,1.25 Inch Curling Iron Brush,Thermal Hair Brush 320°F-400°F,1 1/4 Inch Travel Curling Iron Dual Voltage,PTC Heated Round Brush Ceramic Tourmaline Ionic Hot Brush,Thermal Round Brush"
Unknown,Unknown,Unknown,Unknown,30.84,28.0,Unknown,"Juicer Machines, SiFENE Compact Centrifugal Juicer Extractor, Juice Maker For Vegetable And Fruit With 3-Speed Setting, Easy To Clean, White"
Unknown,Unknown,Unknown,Unknown,5.4,0.0,Unknown,Folding Small Fan USB Charging Storage Office Travel Essential Wind Strong Endurance
Unknown,Unknown,Unknown,Unknown,34.26,28.0,Unknown,"Portable Table Fan NF1, With  Aromatherapy (Inbuilt Battery, Dark Green)"
Unknown,Unknown,Unknown,Unknown,21.5,0.0,Unknown,"1set New Hair Clippers, Professional Quiet Hair Trimmer For Kids And Toddler, Rechargeable Cordless Hair Cutting Machine For Children, With LCD Display"
Unknown,Unknown,Unknown,Unknown,55.44,28.0,Unknown,"Whole Body High Frequency Massager Muscle Relaxation Massager, 6 Head And Neck Membrane Massager 6 Fascia Gun"
Unknown,Unknown,Unknown,Unknown,54.61,28.0,Unknown,"Portable Dryer, Mini Dryer With Timer - Fast And Easy To Use Compact Dryer For Apartments, Dorms, RVs."
Unknown,Unknown,Unknown,Unknown,19.6,0.0,Unknown,"Portable Camping Fan, Desktop Style With Charging Port, Room Ornament, Multifunctional And Oscillating Mini Fan"
Unknown,Unknown,Unknown,Unknown,5.5,0.0,Unknown,"Portable Handheld Silent Mini Fan, Rechargeable, Suitable For Office, Desk, Dormitory, And Students, Ultra Quiet"
Unknown,Unknown,Unknown,Unknown,4.1,0.0,Unknown,1Pc Mini Portable Fan USB Rechargeable Cooler Collapsible Handheld Desktop Fan Quiet Foldable Office Home Handy Power Bank
Unknown,Unknown,Unknown,Unknown,7.6,0.0,Unknown,"1pc Mini Portable Fan, Handheld Fan With Mist, Cooling, And Cute Cartoon Design For Students"
Unknown,Unknown,Unknown,Unknown,15.4,0.0,Unknown,Barber Blading Hair Cutting Machine Clipper Kemei KM-1071Grooming Cordless Rechargeable Professional Shaver Clippers
Unknown,Unknown,Unknown,Unknown,16.6,0.0,Unknown,Kemei Cordless Rechargeable Hair Clipper Advanced Hair Clipper For Men KM-5017
Unknown,Unknown,Unknown,Unknown,15.8,6.0,10+ sold recently,"Portable & Powerful Full Body Massager, Wireless, 10 Vibration Modes, Speed Control, Ideal For Fatigue Relief & Tailored Muscle Therapy"
Unknown,Unknown,Unknown,Unknown,2.46,2.0,Unknown,"1PC USB Charging, Thermal Eyelash Curler Thermal Eyelash Curler Temperature Control Charging Mini Lasting Makeup Tool."
Unknown,Unknown,Unknown,Unknown,5.52,40.0,Unknown,"1pc, Kitchen Scale, Food Scale, Kitchen Weighing Scale, Accurate Kitchen Scale, Electronic Scales, Coffee Electronic Scale, Digital Scales For Kitchen, Baking Scale, Kitchen Accessaries, Baking Tools"
Unknown,Unknown,Unknown,Unknown,8.6,7.0,Unknown,"1pc USB Rechargeable Handheld Pull-Out Mini Fan, 2000mAh Portable Pocket Fan, Quiet Desktop Fan With Mobile Power Function, Suitable For Travel And Outdoor Use"
Unknown,Unknown,Unknown,Unknown,17.8,0.0,70+ sold recently,1Pc Portable Humidifier Fan AIr Conditioner Household Small Air Cooler Hydrocooling Portable Air Adjustment For Office 3 Speed Fan
Unknown,Unknown,Unknown,Unknown,28.02,40.0,Unknown,"Electric Food Chopper Food Processor, 1.8L Glass Bowl Grinder For Meat, Vegetables, Fruits And Nuts Stainless Steel Motor Unit And Sharp Blades, 300W Food Processor Meat Grinder Mini Electric Food Chopper For Food, Meat , Onions, Vegetables"
Unknown,Unknown,Unknown,Unknown,14.19,27.0,40+ sold recently,"1 PC Digital Bathroom Scale, Highly Accurate Body Weight Scale with Lighted LED Display, Round Corner Design, 5-180kg(11-396lbs), Black(Batteries not included)"
Unknown,Unknown,Unknown,Unknown,9.65,50.0,Unknown,"TOUCHBeauty 1pc TOUCHBeauty Mini Air & LED Light Nail Dryer For Regular Nail Polishes, Ideal Gift To Kids Teens Powerful Fan, Battery Powered (Small-PK)"
Unknown,Unknown,Unknown,Unknown,14.7,4.0,30+ sold recently,Electric Splint Small Hair Straightener Bangs Special Straightening Portable Hair Straightener Hair Styling Tool
Unknown,Unknown,Unknown,Unknown,6.0,3.0,100+ sold recently,"Cute Bear Shaped Portable Mini Fan, Multicolor Ombre Design, Ideal For Summer Use"
Unknown,Unknown,Unknown,Unknown,3.3,0.0,10+ sold recently,"Crystal Hair Remover, Reusable Women Shaver For Underarms, Legs, Arms And Bikini Area, Waterproof Painless Exfoliation Crystal Hair Remover For Women, Provide Soft Smooth Silky Skin"
Unknown,Unknown,Unknown,Unknown,13.17,0.0,Unknown,Unbeatablesale 0.5 X 0.5 In. PEX-A Barb Brass Tee Fitting
Unknown,Unknown,#8 Best Sellers,in Temperature Gauges,2.2,0.0,Unknown,"Wooden Wall-Mounted Thermometer, Suitable For Indoor/Outdoor Decoration Of Room, Industrial Workshop And Greenhouse, Portable And Movable Thermometer"
Unknown,Unknown,Unknown,Unknown,11.62,17.0,10+ sold recently,"1pc Usb Charging Electric Foot Grinder, Dead Skin Remover, Callus Remover Automatic Foot Care Tool"
Unknown,Unknown,Unknown,Unknown,4.74,31.0,Unknown,3R Silicone Car Trash Can - Creative Fashion Mini Car Storage Box - Lovely Car Garbage Can
Unknown,Unknown,Unknown,Unknown,37.9,58.0,Unknown,"Retro Mini Refrigerator, Cosmetic Refrigerators, Car Mini Fridge Portable Cooler For Office, Dorm Room, Small Fridge, Drinks Refrigerator, Food Refrigerator, Black"
Unknown,Unknown,Unknown,Unknown,31.4,4.0,Unknown,"Kemei 2pcs Professional Men Electric Shaver, Hair Trimmer Machine, Cordless Hair Cutting Machine, Professional Graffiti Pattern Hair Clipper For Men, Hair Carving Barber Kit With T-Blade"
Unknown,Unknown,Unknown,Unknown,9.4,0.0,Unknown,"1pc + USB Car Seat Fan With Three Speed Wind Control Independent Switch, Compact & Lightweight, Innovative Design, Powerful Wind, Suitable For Car Seats With USB Port"
Unknown,Unknown,Unknown,Unknown,10.5,0.0,Unknown,1pc POREE Rechargable PR1508 Hairball Trimmer Household Shaving Hair Ball Remover
Unknown,Unknown,Unknown,Unknown,41.75,12.0,Unknown,Kitchen Tools Multifunctional Folding Handheld Press Noodle Machine Mould Household Noodle Machine
Unknown,Unknown,Unknown,Unknown,55.0,38.0,Unknown,"14-Cup Programmable Coffee Maker, Regular & Strong Brew Drip Coffee Machine For Home And Office, Glass Carafe, Washable Filter, Keep Warm,  Silver & Stainless Steel"
Unknown,Unknown,Unknown,Unknown,46.99,41.0,30+ sold recently,"HOMM Juicer Machine, 800W Centrifugal Juicer Extractor with Wide Mouth 2.5” Feed Chute for Fruit Vegetable, Cold Press Electric Juicer Machine with 100% High Juice Yield, Easy Clean, Stainless Steel, 2-Speed Setting, Compact Centrifugal Juicer Anti-drip"
Unknown,Unknown,#4 Best Sellers,in Temperature Gauges,2.46,40.0,Unknown,"5pcs Hanging Thermometers With Long Rod, Portable Room Temperature Gauge, Greenhouse Vegetable Temperature Meter, Indoor Thermostat, Home Use Thermometer"
Unknown,Unknown,Unknown,Unknown,25.4,0.0,30+ sold recently,Wireless Car Vacuum Cleaner Powerful Cyclone Handheld USB Rechargeable Large Capacity Dust Cup Fast Charging Home & Car Dual-Purpose Pet Hair Cleaner
Unknown,Unknown,Unknown,Unknown,26.99,33.0,20+ sold recently,"KOOC Small Slow Cooker, 2-Quart, Free Liners Included for Easy Clean-up, Upgraded Ceramic Pot, Adjustable Temp, Nutrient Loss Reduction, Stainless Steel, Pink, Round"
Unknown,Unknown,Unknown,Unknown,59.99,30.0,10+ sold recently,"Paris Rhône Space-Saving Fan TF002, Stand Up Floor Bladeless"
Unknown,Unknown,Unknown,Unknown,24.99,38.0,10+ sold recently,"1Pc For Women KidsDual Voltage Hair Dryer,Travel Mini Hair Dryer Lightweight Quiet Compact Blow Dryer With Concentrator, 1000W Hairdryer With European Plug Travel Size Bag For International Tarvel"
Unknown,Unknown,Unknown,Unknown,17.1,0.0,10+ sold recently,"720-Key Fascia Massage Gun, 1200mAh Rechargeable USB Upgrade Massager For Muscles Relaxation, 4 Massage Heads And 6 Speed Levels, Suitable For Office Sedentary Massage, Athletes And Bodybuilders For Relaxation After Exercise."
Unknown,Unknown,Unknown,Unknown,8.33,33.0,300+ sold recently,"1pc Women's Underarm Hair Removal Device, Epilator For Women, Womens Shaver & Trimmer, Cordless, Rechargeable"
Unknown,Unknown,Unknown,Unknown,13.2,0.0,Unknown,1pc Three Colors Dimmable Led Lighted Makeup Mirror Women's Portable Folding Student Ins-Style Vanity Mirror With Lights For Dormitory/Desktop
Unknown,Unknown,Unknown,Unknown,5.2,0.0,Unknown,"1pc Electronic Measuring Spoon, Spoon Design Electronic Scale For Kitchen"
Unknown,Unknown,Unknown,Unknown,13.7,4.0,30+ sold recently,"Cone Hair Curler,Hairstyling Tool Hair Curling Wand, Ceramic Hair Curler 13-25mm Heating Tube Hairstylist For Salon , Professional Hot Tools Curling Curler Wand"
Unknown,Unknown,Unknown,Unknown,5.7,40.0,Unknown,"1pc Baking Electronic Scale, Stainless Steel Portable Food Scale For Kitchen"
Unknown,Unknown,Unknown,Unknown,31.1,4.0,20+ sold recently,Kemei Electric Clipper KM-2296 Cross Border Electric Clipper With Base USB Oil Head Engraving Clipper Hair Salon Barber
Unknown,Unknown,Unknown,Unknown,44.14,20.0,Unknown,Waffle Iron Sandwich Maker3 In 1 Mini Waffle Maker With Removable Plates Waffle Irons Non-Stick Waffle Cone Maker Waffle Machine For Waffle Grill Sandwich
Unknown,Unknown,Unknown,Unknown,2.6,0.0,Unknown,"16pcs/Set Replacement Brush Heads Compatible With Oral B  Electric Toothbrush, White. Deep And Precise Cleaning, Compatible With   Pro1000 /1500/100/500/Vitality/Genius X/7000/7500/8000/9600 Etc."
Unknown,Unknown,Unknown,Unknown,25.1,0.0,80+ sold recently,"Men Hair Clipper, Haircut Set & Zero Space T Cutter Combo, Cordless Hair Clip Set For Hair Cutting, With LED Display Christmas Gifts"
Unknown,Unknown,#5 Best Sellers,in Laser Hair Removal Devices,19.7,0.0,Unknown,"1pc White Plug Powered Laser Hair Removal Pulses 500,000 Flashes IPL Epilator 5 Levels Depilator Remover Permanent Professional Painless For Women Body Pubic Bikinis Home Use Devices"
Unknown,Unknown,Unknown,Unknown,8.7,3.0,Unknown,"1pc Portable Electric Hair Removal Device, Mini Lady Body Hair Shaver, Full Body Hair Removal For Women, Private Hair Removal"
Unknown,Unknown,Unknown,Unknown,40.99,42.0,Unknown,360° Aire Para Carro De VENTtilador Aires Acondicionados Portatil VENTtilacion 12V
Unknown,Unknown,#7 Best Sellers,in Curling Tongs & Curling Wands,11.4,7.0,Unknown,"3 Barrels Hair Curling Iron, 1pc 22Mm Hair Crimper Temperature Adjustable, Ceramic Tourmaline Fast Heating Hair Curling Iron For Water Ripple Crimping, Egg Rolls, Straightening, Curling"
Unknown,Unknown,Unknown,Unknown,22.4,4.0,Unknown,"Beard Trimmer, Mens Grooming Kit With Hair Clippers, Electric Razor, Shavers For Mustache, Body, Face, Ear, Nose Hair Trimmer, USB Rechargeable & LED Display"
Unknown,Unknown,Unknown,Unknown,10.7,4.0,Unknown,"Mini Ionic Hair Curler With LCD Display, Wool & Ceramic Hair Curling Iron, Small Hair Styling Tool"
Unknown,Unknown,Unknown,Unknown,39.99,50.0,Unknown,"Automatic Mouthwash Dispenser Touchless 700mL(23.67 Oz),Wall Mounted Mouth Wash Dispenser for Bathroom with Magnetic Cups,Perfect for Kids and Adults"
Unknown,Unknown,Unknown,Unknown,9.3,0.0,Unknown,"H13 True HEPA Filter Replacement For Fillo/Halo/Mooka Allo,3-In-1 Pre-Filter And Activated Carbon Filtration System With Filter Replacement, 1 Pack."
Unknown,Unknown,Unknown,Unknown,26.7,4.0,80+ sold recently,"1pc Newest Automatic Curling Wand Rotating Curling Iron, Professional 28mm/1.1 Inch Hair Curler Hair Styling Irons Fast Heating Wand For Medium/Long Hair"
Unknown,Unknown,Unknown,Unknown,43.51,5.0,20+ sold recently,Handheld Steam Cleaner 1.2L Portable High-Temperature Pressurized Steam Cleaning Machine With Brush Head For Kitchen Furniture Bathroom
Unknown,Unknown,Unknown,Unknown,29.99,40.0,Unknown,"Masticating Juicer Attachment For KitchenAid Stand Mixers, Slow Juicer, White (Machine/Mixer Not Included)"
Unknown,Unknown,Unknown,Unknown,23.97,19.0,30+ sold recently,1pc 30KG / 1G Precision  LCD Digital Scale Electronic Balance Weight Scale Plastic Weight Scale Accuracy Weight Balance food Scales
Unknown,Unknown,Unknown,Unknown,13.01,55.0,10+ sold recently,"Portable Blender, Blender for Shakes and Smoothies, Personal Blender, USB Rechargeable 14 Oz Mini Blender With for Traveling, Outdoor, Gym, Office(White))"
Unknown,Unknown,Unknown,Unknown,18.4,0.0,60+ sold recently,A5 Wireless Handheld Vacuum Cleaner (Black+Silver) With Hose
Unknown,Unknown,#5 Best Sellers,in Table Fans,6.53,22.0,Unknown,"Clip-On Usb Powered Fan With 3 Adjustable Speeds, Mini & Quiet Rechargeable Clip Fan, Suitable For Dorm, Office, Study, Etc. White Color, 2 Power Supply Modes: Battery Storage (Including A 18650 Lithium Battery) And Usb Power (Can Be Plugged Into A Computer Usb Port), Blade Diameter: 80mm"
Unknown,Unknown,Unknown,Unknown,30.98,61.0,Unknown,"Electric Spin Scrubber, 2024 New Cordless Shower Scrubber With 8 Replaceable Brush Heads, 2.5H Bathroom Scrubber Dual Speed, Shower Cleaner Brush With Extension Arm For Bathtub Tile Floor"
Unknown,Unknown,Unknown,Unknown,12.6,0.0,Unknown,1pc Portable 400ml Rechargeable Juicer Blender High Capacity Battery Six Blade Fast Ice Crushing For Smoothies  Veggie And Fruit Juices Perfect For Kitchen And Travel
Unknown,Unknown,Unknown,Unknown,23.4,0.0,Unknown,Black Manual Capsule Coffee Machine
Unknown,Unknown,Unknown,Unknown,31.34,22.0,Unknown,"Dezin Mini Rice Cooker 2 Cups Uncooked, 1L Rice Cooker Small, Portable Travel Electric Cooker, Multi-Function Non-Stick Rice Maker With Timer Delay & Keep Warm Function"
Unknown,Unknown,Unknown,Unknown,44.99,50.0,20+ sold recently,"HOMM Juicer Machine, 800W Centrifugal Juicer Extractor With Wide Mouth 2.5"" Feed Chute For Fruit Vegetable, Cold Press Electric Juicer Machine With 100% High Juice Yield, Easy Clean, Stainless Steel, 2-Speed Setting, Compact Centrifugal Juicer Anti-Drip,Red"
Unknown,Unknown,Unknown,Unknown,64.3,0.0,Unknown,"Laser Hair Removal For Women And Men - IPL Hair Removal With Ice-Cooling System For Painless & Long-Lasting Result, Whole Body Hair Removal"
Unknown,Unknown,Unknown,Unknown,69.99,55.0,Unknown,"VEVOR Pivoting Utility Fan, 600 CFM High Velocity Floor Blower For Drying, Cooling, Ventilating, Exhausting, 300° Blowing Angle Air Mover, Portable Carpet Dryer Fan For Home, Work Shop"
Unknown,Unknown,Unknown,Unknown,4.7,0.0,Unknown,"1pc Electric Shaver For Trimmers Battery Operated Travel Friendly Body Hair Trimmer For Women, Cordless Lady's Hair Removal, Dry Use Bikini Trimmer For Legs, Underarms, Bikini (Battery Not Included)"
Unknown,Unknown,Unknown,Unknown,18.8,0.0,Unknown,"1pc USB Power Cord 300ML Essential Oil Diffuser, Quiet Premium Humidifier With Remote Control, Natural Home Fragrance Aroma Diffuser With 7 LED Color Changing Light And Timer- Wood Grain/Solid Color"
Unknown,Unknown,Unknown,Unknown,14.4,0.0,10+ sold recently,"Automatic Electric Hair Curling Roller Machine, Ceramic Straightening & Wavy Hair Curling Styling Tool For Women & Teen Girls, Easy Operation Hair Curler"
Unknown,Unknown,#7 Best Sellers,in Electric Space Heater,29.99,55.0,Unknown,"Space Heater HE003, 1500W 24"" Oscillating Ceramic Tower Heater W/ Remote, Indoor, Black"
Unknown,Unknown,Unknown,Unknown,39.99,56.0,Unknown,"29"" 1500W Countertop Electric Barbecue Grill Hot Plate Temperature Control Cooking BBQ Griddle Non-Stick Table Top Grill Griddle Portable For Indoor Outdoor Kitchen Camping Picnic"
Unknown,Unknown,Unknown,Unknown,21.6,4.0,20+ sold recently,"D4 Hair Clippers For Men Professional - Cordless&Corded Barber Clippers For Hair Cutting & Grooming, Rechargeable Beard Trimmer Hair Clippers Professional Cordless For Men, Barber Clippers For Hair Cutting Kit, Wireless LCD Display Hair Trimmers Set"
Unknown,Unknown,#9 Best Sellers,in Styling Tools & Appliances,8.2,0.0,Unknown,"1pc Multi-functional 28mm Spiral Hair Curling Iron, Suitable For Wet And Dry Hair, Create Different Types Of Wavy Curls"
Unknown,Unknown,Unknown,Unknown,10.5,40.0,Unknown,"New Outdoor Solar Animal Repellent Rat Repellent Bird Repellent Flash Animal Repellent, Animal Repellent."
Unknown,Unknown,Unknown,Unknown,10.2,4.0,Unknown,"1pc LED Makeup Mirror, 3 Lighting Modes, Adjustable Brightness, Foldable Function, Portable High-Definition Mirror, Rechargeable For Use"
Unknown,Unknown,Unknown,Unknown,10.4,4.0,Unknown,"Professional Electric Hair Clipper USB Cordless Electric Clipper Barber Beard Trimmer,USB Rechargeable Barber Hair Clipper Beard Rrimmer, Powerful Haircut Machine"
Unknown,Unknown,Unknown,Unknown,12.84,38.0,10+ sold recently,"Automatic Curling Iron, Negative Ion, Large Curl, Big Wave, Long Lasting Styling, Adjustable Curling Artifact."
Unknown,Unknown,Unknown,Unknown,15.3,0.0,Unknown,"1pc Rechargeable Portable Humidifier Fan For Air Conditioning, Household Small Air Cooler, Water-Cooled Portable Air Conditioning, Office 5-Speed Fan"
Unknown,Unknown,Unknown,Unknown,9.6,0.0,Unknown,"Kemei Professional Female Hair Removal Machine, Two Colors To Choose (Pink, Purple) , Easy To Quickly Hair Removal, Detachable Knife Head, Easy To Clean, Battery Durable And Rechargeable, Ladies Must, Family Must, Applicable To Travel And Holiday Gifts"
Unknown,Unknown,Unknown,Unknown,59.9,54.0,Unknown,"New Tower Fans For Home, 80° Oscillating Standing Fans With Remote, 18 Ft/S Velocity Quiet Bedroom Fan, 3 Speeds, Bladeless Floor Fan, Black"
Unknown,Unknown,Unknown,Unknown,8.9,0.0,Unknown,"2-In-1 Hair Straightener And Curler, Mini Hair Curling Wand, Hair Styling Tool For Straightening And Curling, Wet & Dry Bangs Clipper, Home Use"
Unknown,Unknown,Unknown,Unknown,11.2,0.0,10+ sold recently,1 Pcs Fabric Shaver Lint Remover Rechargeable Electric Portable Sweater Defuzzer With 3 Speeds Digital LED Display To Remove Pilling For Clothes Furniture Sweater Couch Blanket
Unknown,Unknown,Unknown,Unknown,11.1,0.0,Unknown,"1pc Mini Smart Fingerprint Padlock, Waterproof Security Door Lock, Antitheft Keyless USB Rechargeable Lock For Suitcase Luggage"
Unknown,Unknown,Unknown,Unknown,12.1,0.0,Unknown,"Portable 4 In 1 Electric Vegetable Slicer Set, Wireless Food Processor, With Clean Brush For Garlic Chili Onion Celery Ginger Meat"
Unknown,Unknown,Unknown,Unknown,37.99,61.0,50+ sold recently,"Juicer Machine, 500W Centrifugal Juicer Extractor With Wide Mouth 3"" Feed Chute For Fruit Vegetable, Easy To Clean, Stainless Steel,Red"
Unknown,Unknown,Unknown,Unknown,2.17,65.0,10+ sold recently,"Precision Replacement Brush Heads Compatible With Oral B Electric Toothbrush, White."
Unknown,Unknown,Unknown,Unknown,3.2,3.0,Unknown,"1pc Mini Portable Electric Shaver With USB Charging, Razor"
Unknown,Unknown,Unknown,Unknown,16.7,4.0,20+ sold recently,"1pc 2x 3x Magnification Three-Folding Makeup Mirror With 22 LEDs, Suitable For Home, Travel, Portable, Foldable USB Makeup Mirror"
Unknown,Unknown,Unknown,Unknown,16.6,0.0,Unknown,"Adult Ultrasonic Electric Toothbrush, USB Rechargeable, 3 Working Modes, With 4 Replaceable Microfiber Brush Heads, Medium Hardness, Unscented,, Lithium Battery Powered, Suitable For Sensitive Gums - Full Mouth Cleaning, Daily Use"
Unknown,Unknown,Unknown,Unknown,21.49,28.0,Unknown,"Heavy Duty Manual Meat Grinder, Aluminum Alloy Food Mincer Durable Grind Manual Sausage Meat Grinder Clamp-On Hand Grinder For Home Use"
Unknown,Unknown,Unknown,Unknown,39.99,33.0,Unknown,"Mini Skincare Fridge 4L With Dimmable LED Light Mirror, Cooler And Warmer For Refrigerating Make Up, And Food, Portable Mini Fridge For Bedroom, Office And Car Usage, Pink"
Unknown,Unknown,Unknown,Unknown,8.01,10.0,30+ sold recently,"Nail Clippers, Nail File, Electric Nail Clipper, Electric Automatic Nail Clipper, Electric Nail Clippers For Adults, Seniors, Nail Clippers Electric, Automatic Nail Clippers, Electric Nail Trimmer, Christmas Gift"
Unknown,Unknown,Unknown,Unknown,17.2,17.0,Unknown,Electric Toothbrush Ultrasonic Cleaning Wireless Charging 5 Modes 6 Replacement Brush Heads Ipx7 Waterproof Protection For Dental Health With Travel Box For Home And Travel Use
Unknown,Unknown,Unknown,Unknown,12.8,3.0,Unknown,"1 Piece Rechargeable 304 Stainless Steel Multifunctional Electric Vegetable Chopper,350ml Easy To Carry,Food Processor And Chopper For Garlic, Pepper, Onion, Celery, Ginger, Meat,Kitchen Gadgets"
Unknown,Unknown,Unknown,Unknown,68.99,30.0,Unknown,"High Velocity 12"" Floor Fan Portable Outdoor Indoor 3 Speeds Adjustable Tilt Fan"
Unknown,Unknown,Unknown,Unknown,48.99,48.0,Unknown,"Electric Meat Grinder Heavy Duty, 3000W Max Meat Mincer With 3 Stainless Steel Grinding And Sausage Stuffing Tubes For Home Use &Commercial"
Unknown,Unknown,Unknown,Unknown,11.8,0.0,10+ sold recently,"1pc English Language Wrist Blood Pressure Monitor With USB Cable, Adjustable Blood Pressure Monitor For Home Use, Large Screen Display And Voice Reporting, Measures Heart Rate, Powered By Lithium Battery"
Unknown,Unknown,Unknown,Unknown,54.98,44.0,20+ sold recently,Costway 1000W Multifunction Portable Hand-held Steam Cleaner W/10 Accessories
Unknown,Unknown,Unknown,Unknown,12.6,10.0,Unknown,"Heating Pad For Period Cramps, Portable Menstrual Cordless Electric Heated Pads For Pain Relief With Massager Rechargeable Heating Pad Birthday Gifts For Mom Women Girlfriend"
Unknown,Unknown,Unknown,Unknown,41.5,3.0,Unknown,"Household Induction Cooker, Intelligent Multifunctional Hot Pot And Stir Fry Cooker"
