goods-title-link--jump,goods-title-link--jump href,rank-title,rank-sub,price,discount,selling_proposition,goods-title-link
"1pc Rechargeable Deep Tissue Muscle Handheld Massage Gun, Suitable For Body, Back And Neck Pain, Ultra-Compact Elegant Design, High-Torque Driven Massager",https://us.shein.com/1pc-Rechargeable-Deep-Tissue-Muscle-Handheld-Massage-Gun-Suitable-For-Body-Back-And-Neck-Pain-Ultra-Compact-Elegant-Design-High-Torque-Driven-Massager-p-21940454.html?src_identifier=fc%3DAppliances%60sc%3DAppliances%60tc%3D0%60oc%3D0%60ps%3Dtab22navbar22%60jc%3DitemPicking_017172977&src_module=topcat&src_tab_page_id=page_select_class1718930176672&mallCode=1&pageListType=2,#1 Best Sellers,in Give Gifts,2.03,22.0,Unknown,Unknown
1pc Portable Hanging Neck Fan,https://us.shein.com/1pc-Portable-Hanging-Neck-Fan-p-16414241.html?src_identifier=fc%3DAppliances%60sc%3DAppliances%60tc%3D0%60oc%3D0%60ps%3Dtab22navbar22%60jc%3DitemPicking_017172977&src_module=topcat&src_tab_page_id=page_select_class1718930176672&mallCode=1&pageListType=2,#4 Best Sellers,in Top rated in Portable Fans,6.48,20.0,Unknown,Unknown
"1pc Pink Colored Curved Eyelash Curler False Eyelash Auxiliary Makeup Tool For Women, Portable",https://us.shein.com/1pc-Pink-Colored-Curved-Eyelash-Curler-False-Eyelash-Auxiliary-Makeup-Tool-For-Women-Portable-p-27577034.html?src_identifier=fc%3DAppliances%60sc%3DAppliances%60tc%3D0%60oc%3D0%60ps%3Dtab22navbar22%60jc%3DitemPicking_017172977&src_module=topcat&src_tab_page_id=page_select_class1718930176672&mallCode=1&pageListType=2,Unknown,Unknown,1.8,0.0,400+ sold recently,Unknown
"1 Mini Portable Handheld Fan With 2 Aa Batteries (Batteries Not Included), Comes With A Lanyard",https://us.shein.com/1-Mini-Portable-Handheld-Fan-With-2-Aa-Batteries-Batteries-Not-Included-Comes-With-A-Lanyard-p-29977701.html?src_identifier=fc%3DAppliances%60sc%3DAppliances%60tc%3D0%60oc%3D0%60ps%3Dtab22navbar22%60jc%3DitemPicking_017172977&src_module=topcat&src_tab_page_id=page_select_class1718930176672&mallCode=1&pageListType=2,Unknown,Unknown,0.88,72.0,5.6k+ sold recently,Unknown
"Wit Water Flosser,Portable Oral Irrigator With 3 Modes, Nasal Washer, 4 Replaceable Nozzles, Rechargeable Waterproof Tooth Cleaner, For Home And Travel, Removable Large Water Tank",https://us.shein.com/Wit-Water-Flosser-Portable-Oral-Irrigator-With-3-Modes-Nasal-Washer-4-Replaceable-Nozzles-Rechargeable-Waterproof-Tooth-Cleaner-For-Home-And-Travel-Removable-Large-Water-Tank-p-35891349.html?src_identifier=fc%3DAppliances%60sc%3DAppliances%60tc%3D0%60oc%3D0%60ps%3Dtab22navbar22%60jc%3DitemPicking_017172977&src_module=topcat&src_tab_page_id=page_select_class1718930176672&mallCode=1&pageListType=2,#6 Best Sellers,in Oral Irrigators,12.06,40.0,Unknown,Unknown
"1pc Ice Pop Mold, Plastic Ice Cream Mold, Frozen Ice Pop Box, Safe Jelly Mould, Kitchen Utensils, Kitchen Accessories",https://us.shein.com/1pc-Ice-Pop-Mold-Plastic-Ice-Cream-Mold-Frozen-Ice-Pop-Box-Safe-Jelly-Mould-Kitchen-Utensils-Kitchen-Accessories-p-36156215.html?src_identifier=fc%3DAppliances%60sc%3DAppliances%60tc%3D0%60oc%3D0%60ps%3Dtab22navbar22%60jc%3DitemPicking_017172977&src_module=topcat&src_tab_page_id=page_select_class1718930176672&mallCode=1&pageListType=2,#10 Best Sellers,in Refrigerators & Freezers,2.7,0.0,Unknown,Unknown
"Mini Pocket Bluetooth Thermal Printer, Portable Wireless Inkless Printing Machine For Pictures, Notes, Photos, Journals, DIY, Compatible With IOS And Android Phones",https://us.shein.com/Mini-Pocket-Bluetooth-Thermal-Printer-Portable-Wireless-Inkless-Printing-Machine-For-Pictures-Notes-Photos-Journals-DIY-Compatible-With-IOS-And-Android-Phones-p-34258470.html?src_identifier=fc%3DAppliances%60sc%3DAppliances%60tc%3D0%60oc%3D0%60ps%3Dtab22navbar22%60jc%3DitemPicking_017172977&src_module=topcat&src_tab_page_id=page_select_class1718930176672&mallCode=1&pageListType=2,#8 Best Sellers,in Other Household Appliances,3.5,0.0,Unknown,Unknown
"1 PC 400ML Classic Ultra-Silent Air Humidifier With Dazzling Coloured Lights,Desktop/Car Humidification",https://us.shein.com/1-PC-400ML-Classic-Ultra-Silent-Air-Humidifier-With-Dazzling-Coloured-Lights-Desktop-Car-Humidification-p-35515287.html?src_identifier=fc%3DAppliances%60sc%3DAppliances%60tc%3D0%60oc%3D0%60ps%3Dtab22navbar22%60jc%3DitemPicking_017172977&src_module=topcat&src_tab_page_id=page_select_class1718930176672&mallCode=1&pageListType=2,Unknown,Unknown,4.9,0.0,Unknown,Unknown
"6 Modes Multi-Functional Sonic Electric Toothbrush, 8/4 Heads Kit, Equipped With 2 Minutes Smart Timer And 30S Area Switch Reminder, Waterproof Usb Rechargeable Oral Cleaner Set For Family Or Travel Use",https://us.shein.com/6-Modes-Multi-Functional-Sonic-Electric-Toothbrush-8-4-Heads-Kit-Equipped-With-2-Minutes-Smart-Timer-And-30S-Area-Switch-Reminder-Waterproof-Usb-Rechargeable-Oral-Cleaner-Set-For-Family-Or-Travel-Use-p-21788261.html?src_identifier=fc%3DAppliances%60sc%3DAppliances%60tc%3D0%60oc%3D0%60ps%3Dtab22navbar22%60jc%3DitemPicking_017172977&src_module=topcat&src_tab_page_id=page_select_class1718930176672&mallCode=1&pageListType=2,#6 Best Sellers,in Oral Care Appliances,4.28,41.0,Unknown,Unknown
"1pc AA Battery Operated Portable Handheld Mini Fan With Strap, Simple Design, 1-Speed For Outdoor Use",https://us.shein.com/1pc-AA-Battery-Operated-Portable-Handheld-Mini-Fan-With-Strap-Simple-Design-1-Speed-For-Outdoor-Use-p-11243151.html?src_identifier=fc%3DAppliances%60sc%3DAppliances%60tc%3D0%60oc%3D0%60ps%3Dtab22navbar22%60jc%3DitemPicking_017172977&src_module=topcat&src_tab_page_id=page_select_class1718930176672&mallCode=1&pageListType=2,#9 Best Sellers,in Household Appliances,2.76,5.0,Unknown,Unknown
"Teckwe Epilator,2*AAA Batteries Portability Removal Device,Cordless Epilators Hair Removal For Women,Hair Removal Cordless Electric Trimmer For Legs Arms Armpit Bikini,Product Does Not Include Batteries",https://us.shein.com/Teckwe-Epilator-2-AAA-Batteries-Portability-Removal-Device-Cordless-Epilators-Hair-Removal-For-Women-Hair-Removal-Cordless-Electric-Trimmer-For-Legs-Arms-Armpit-Bikini-Product-Does-Not-Include-Batteries-p-28126805.html?src_identifier=fc%3DAppliances%60sc%3DAppliances%60tc%3D0%60oc%3D0%60ps%3Dtab22navbar22%60jc%3DitemPicking_017172977&src_module=topcat&src_tab_page_id=page_select_class1718930176672&mallCode=1&pageListType=2,#1 Best Sellers,in Women Shave & Hair Removal Appliances,4.29,35.0,Unknown,Unknown
"1pc Portable Pink Electric Eyelash Curler, USB Rechargeable Eye Makeup Tool - Effortlessly Curl Your Eyelashes",https://us.shein.com/1pc-Portable-Pink-Electric-Eyelash-Curler-USB-Rechargeable-Eye-Makeup-Tool-Effortlessly-Curl-Your-Eyelashes-p-35196252.html?src_identifier=fc%3DAppliances%60sc%3DAppliances%60tc%3D0%60oc%3D0%60ps%3Dtab22navbar22%60jc%3DitemPicking_017172977&src_module=topcat&src_tab_page_id=page_select_class1718930176672&mallCode=1&pageListType=2,Unknown,Unknown,2.5,0.0,50+ sold recently,Unknown
"Reusable Magic Hair Eraser, Painless Exfoliator Removal For Back, Arms, Legs, Portable Epilator Device For Women And Men, Washable Body Hair Trimmer, Efficient Bikini Line Shaver",https://us.shein.com/Reusable-Magic-Hair-Eraser-Painless-Exfoliator-Removal-For-Back-Arms-Legs-Portable-Epilator-Device-For-Women-And-Men-Washable-Body-Hair-Trimmer-Efficient-Bikini-Line-Shaver-p-36157332.html?src_identifier=fc%3DAppliances%60sc%3DAppliances%60tc%3D0%60oc%3D0%60ps%3Dtab22navbar22%60jc%3DitemPicking_017172977&src_module=topcat&src_tab_page_id=page_select_class1718930176672&mallCode=1&pageListType=2,Unknown,Unknown,2.7,0.0,30+ sold recently,Unknown
"Vacuum Sealer For 110V-220V, Food Protector Vacuum Sealer Machine, Automatic Food Vacuum Sealer For Food Preservation Sealing Packing System, For Fresh Food And Food Storage Lightning Deals",https://us.shein.com/Vacuum-Sealer-For-110V-220V-Food-Protector-Vacuum-Sealer-Machine-Automatic-Food-Vacuum-Sealer-For-Food-Preservation-Sealing-Packing-System-For-Fresh-Food-And-Food-Storage-Lightning-Deals-p-33527826.html?src_identifier=fc%3DAppliances%60sc%3DAppliances%60tc%3D0%60oc%3D0%60ps%3Dtab22navbar22%60jc%3DitemPicking_017172977&src_module=topcat&src_tab_page_id=page_select_class1718930176672&mallCode=1&pageListType=2,#6 Best Sellers,in Vacuum Food Sealers,4.8,0.0,Unknown,Unknown
"3pcs/Set Laundry Drying Balls, 6cm Reusable Household Washing Machine Balls, Laundry Appliance Accessories",https://us.shein.com/3pcs-Set-Laundry-Drying-Balls-6cm-Reusable-Household-Washing-Machine-Balls-Laundry-Appliance-Accessories-p-33772405.html?src_identifier=fc%3DAppliances%60sc%3DAppliances%60tc%3D0%60oc%3D0%60ps%3Dtab22navbar22%60jc%3DitemPicking_017172977&src_module=topcat&src_tab_page_id=page_select_class1718930176672&mallCode=1&pageListType=2,Unknown,Unknown,1.49,55.0,60+ sold recently,Unknown
"1pc 900ml Manual Food Processor Garlic Vegetable Chopper, Suitable For Chopping Garlic, Ginger, Chili, Onion And Other Foods",https://us.shein.com/1pc-900ml-Manual-Food-Processor-Garlic-Vegetable-Chopper-Suitable-For-Chopping-Garlic-Ginger-Chili-Onion-And-Other-Foods-p-27977030.html?src_identifier=fc%3DAppliances%60sc%3DAppliances%60tc%3D0%60oc%3D0%60ps%3Dtab22navbar22%60jc%3DitemPicking_017172977&src_module=topcat&src_tab_page_id=page_select_class1718930176672&mallCode=1&pageListType=2,#8 Best Sellers,in Juicer & Food Processor,3.07,63.0,Unknown,Unknown
"1pc White Half-Wrap Fan Dustproof Cover For Home Use, Waterproof, Moisture-Proof, Dustproof Fan Protective Cover, Easy To Put On And Take Off, Washable And Reusable, Keeping The Fan Clean",https://us.shein.com/1pc-White-Half-Wrap-Fan-Dustproof-Cover-For-Home-Use-Waterproof-Moisture-Proof-Dustproof-Fan-Protective-Cover-Easy-To-Put-On-And-Take-Off-Washable-And-Reusable-Keeping-The-Fan-Clean-p-33416096.html?src_identifier=fc%3DAppliances%60sc%3DAppliances%60tc%3D0%60oc%3D0%60ps%3Dtab22navbar22%60jc%3DitemPicking_017172977&src_module=topcat&src_tab_page_id=page_select_class1718930176672&mallCode=1&pageListType=2,#5 Best Sellers,in Cleaning Appliance Parts,1.86,28.0,Unknown,Unknown
"Ear Wax Removal Tool Camera,Ear Cleaner With Camera,Ear Wax Cleaner With Camera,7 Ear Pick,10pcs Bebird Replacement Tips,1080p Ear Camera,6 Led Lights,Earwax Removal Kit For Daily Ear Canal Cleaning",https://us.shein.com/Ear-Wax-Removal-Tool-Camera-Ear-Cleaner-With-Camera-Ear-Wax-Cleaner-With-Camera-7-Ear-Pick-10pcs-Bebird-Replacement-Tips-1080p-Ear-Camera-6-Led-Lights-Earwax-Removal-Kit-For-Daily-Ear-Canal-Cleaning-p-33253724.html?src_identifier=fc%3DAppliances%60sc%3DAppliances%60tc%3D0%60oc%3D0%60ps%3Dtab22navbar22%60jc%3DitemPicking_017172977&src_module=topcat&src_tab_page_id=page_select_class1718930176672&mallCode=1&pageListType=2,Unknown,Unknown,24.1,0.0,Unknown,Unknown
"1pc Blue Lint Remover, Wool Sweater Shaver, Clothes Fuzz Ball Trimmer For Home Use",https://us.shein.com/1pc-Blue-Lint-Remover-Wool-Sweater-Shaver-Clothes-Fuzz-Ball-Trimmer-For-Home-Use-p-23831823.html?src_identifier=fc%3DAppliances%60sc%3DAppliances%60tc%3D0%60oc%3D0%60ps%3Dtab22navbar22%60jc%3DitemPicking_017172977&src_module=topcat&src_tab_page_id=page_select_class1718930176672&mallCode=1&pageListType=2,#9 Best Sellers,in Laundry Appliances,0.75,53.0,Unknown,Unknown
"1pc Four Layer Slide Egg Storage Box, Refrigerator Side Door Storage Box, Rolling Egg  Egg Rack Holder, Automatic Rolling Egg Box",https://us.shein.com/1pc-Four-Layer-Slide-Egg-Storage-Box-Refrigerator-Side-Door-Storage-Box-Rolling-Egg-Egg-Rack-Holder-Automatic-Rolling-Egg-Box-p-35264869.html?src_identifier=fc%3DAppliances%60sc%3DAppliances%60tc%3D0%60oc%3D0%60ps%3Dtab22navbar22%60jc%3DitemPicking_017172977&src_module=topcat&src_tab_page_id=page_select_class1718930176672&mallCode=1&pageListType=2,Unknown,Unknown,14.6,0.0,30+ sold recently,Unknown
"New 2 In 1 Mini Irons, Mini Travel Iron, Portable Ironing Clothes Foldable Rotating Handheld Irons, Travel Mini Irons Wrinkle Remover Ironing Machine",https://us.shein.com/New-2-In-1-Mini-Irons-Mini-Travel-Iron-Portable-Ironing-Clothes-Foldable-Rotating-Handheld-Irons-Travel-Mini-Irons-Wrinkle-Remover-Ironing-Machine-p-33809318.html?src_identifier=fc%3DAppliances%60sc%3DAppliances%60tc%3D0%60oc%3D0%60ps%3Dtab22navbar22%60jc%3DitemPicking_017172977&src_module=topcat&src_tab_page_id=page_select_class1718930176672&mallCode=1&pageListType=2,#2 Best Sellers,in Laundry Appliances,11.25,11.0,Unknown,Unknown
Mini Portable USB Charging Sealing Machine For Snack Plastic Bags - Easy Manual Sealing Clip With Fast Charging Benefits,https://us.shein.com/Mini-Portable-USB-Charging-Sealing-Machine-For-Snack-Plastic-Bags-Easy-Manual-Sealing-Clip-With-Fast-Charging-Benefits-p-31598820.html?src_identifier=fc%3DAppliances%60sc%3DAppliances%60tc%3D0%60oc%3D0%60ps%3Dtab22navbar22%60jc%3DitemPicking_017172977&src_module=topcat&src_tab_page_id=page_select_class1718930176672&mallCode=1&pageListType=2,Unknown,Unknown,2.15,50.0,100+ sold recently,Unknown
1pc Plain Egg Separator,https://us.shein.com/1pc-Plain-Egg-Separator-p-16704675.html?src_identifier=fc%3DAppliances%60sc%3DAppliances%60tc%3D0%60oc%3D0%60ps%3Dtab22navbar22%60jc%3DitemPicking_017172977&src_module=topcat&src_tab_page_id=page_select_class1718930176672&mallCode=1&pageListType=2,Unknown,Unknown,0.74,47.0,100+ sold recently,Unknown
"6 Blades USB Portable Juicer Maker, Juicer Fruit Juice Cup Automatic Small Electric Juicer Smoothie Blender Ice CrushCup Food Processor",https://us.shein.com/6-Blades-USB-Portable-Juicer-Maker-Juicer-Fruit-Juice-Cup-Automatic-Small-Electric-Juicer-Smoothie-Blender-Ice-CrushCup-Food-Processor-p-32346773.html?src_identifier=fc%3DAppliances%60sc%3DAppliances%60tc%3D0%60oc%3D0%60ps%3Dtab22navbar22%60jc%3DitemPicking_017172977&src_module=topcat&src_tab_page_id=page_select_class1718930176672&mallCode=1&pageListType=2,#6 Best Sellers,in Fruit & Vegetable Tools,8.94,28.0,Unknown,Unknown
"1PC 16LED USB/Battery Dual Use Makeup Mirror Light, Desktop Mirror Surface Rotatable Makeup Mirror Light 3-Speed Touch Screen Vanity Mirror, Brightness Adjustable Cosmetic Light Up Mirror, Portable Dormitory Bedroom Desktop Vanity Mirror With Light",https://us.shein.com/1PC-16LED-USB-Battery-Dual-Use-Makeup-Mirror-Light-Desktop-Mirror-Surface-Rotatable-Makeup-Mirror-Light-3-Speed-Touch-Screen-Vanity-Mirror-Brightness-Adjustable-Cosmetic-Light-Up-Mirror-Portable-Dormitory-Bedroom-Desktop-Vanity-Mirror-With-Light-p-25998344.html?src_identifier=fc%3DAppliances%60sc%3DAppliances%60tc%3D0%60oc%3D0%60ps%3Dtab22navbar22%60jc%3DitemPicking_017172977&src_module=topcat&src_tab_page_id=page_select_class1718930176672&mallCode=1&pageListType=2,Unknown,Unknown,8.55,29.0,200+ sold recently,Unknown
"1pc Silicone Ice Cube Trays With Lids, 2 Inches Rose Ice Cube Trays With Covers, 6 Cavity Silicone Rose Ice Ball Maker, Easy Release Large Ice Cube Form For Chilled Cocktails, Whiskey, Bourbon & Homemade Juice",https://us.shein.com/1pc-Silicone-Ice-Cube-Trays-With-Lids-2-Inches-Rose-Ice-Cube-Trays-With-Covers-6-Cavity-Silicone-Rose-Ice-Ball-Maker-Easy-Release-Large-Ice-Cube-Form-For-Chilled-Cocktails-Whiskey-Bourbon-Homemade-Juice-p-36158834.html?src_identifier=fc%3DAppliances%60sc%3DAppliances%60tc%3D0%60oc%3D0%60ps%3Dtab22navbar22%60jc%3DitemPicking_017172977&src_module=topcat&src_tab_page_id=page_select_class1718930176672&mallCode=1&pageListType=2,Unknown,Unknown,4.7,13.0,Unknown,Unknown
"1pc Pink 500ml Manual Garlic Masher For Home Use, Hand-held Garlic Press For Cutting Vegetables, Suitable For Chopping Garlic, Ginger, Chili, Onion And Other Foods",https://us.shein.com/1pc-Pink-500ml-Manual-Garlic-Masher-For-Home-Use-Hand-held-Garlic-Press-For-Cutting-Vegetables-Suitable-For-Chopping-Garlic-Ginger-Chili-Onion-And-Other-Foods-p-25154681.html?src_identifier=fc%3DAppliances%60sc%3DAppliances%60tc%3D0%60oc%3D0%60ps%3Dtab22navbar22%60jc%3DitemPicking_017172977&src_module=topcat&src_tab_page_id=page_select_class1718930176672&mallCode=1&pageListType=2,#7 Best Sellers,in Blenders,3.46,48.0,Unknown,Unknown
"1pc Wax Bean Heater Hair Removal Tool For Both Women & Men, Large Capacity",https://us.shein.com/1pc-Wax-Bean-Heater-Hair-Removal-Tool-For-Both-Women-Men-Large-Capacity-p-21530539.html?src_identifier=fc%3DAppliances%60sc%3DAppliances%60tc%3D0%60oc%3D0%60ps%3Dtab22navbar22%60jc%3DitemPicking_017172977&src_module=topcat&src_tab_page_id=page_select_class1718930176672&mallCode=1&pageListType=2,Unknown,Unknown,12.5,0.0,100+ sold recently,Unknown
1PC Epilator Face Hair Removal Lipstick Shaver Electric Eyebrow Trimmer Women's Painless Hair Remover Mini Shaver Epilator For Women [Dry Cell Type (Excluding Battery)],https://us.shein.com/1PC-Epilator-Face-Hair-Removal-Lipstick-Shaver-Electric-Eyebrow-Trimmer-Women-s-Painless-Hair-Remover-Mini-Shaver-Epilator-For-Women-Dry-Cell-Type-Excluding-Battery-p-18607363.html?src_identifier=fc%3DAppliances%60sc%3DAppliances%60tc%3D0%60oc%3D0%60ps%3Dtab22navbar22%60jc%3DitemPicking_017172977&src_module=topcat&src_tab_page_id=page_select_class1718930176672&mallCode=1&pageListType=2,Unknown,Unknown,2.6,4.0,8.7k+ sold recently,Unknown
1pc + Rechargeable + 500mah Lithium Battery + Handheld Portable + Standable + With Hanging Rope + 3-Level Adjustable,https://us.shein.com/1pc-Rechargeable-500mah-Lithium-Battery-Handheld-Portable-Standable-With-Hanging-Rope-3-Level-Adjustable-p-30318916.html?src_identifier=fc%3DAppliances%60sc%3DAppliances%60tc%3D0%60oc%3D0%60ps%3Dtab22navbar22%60jc%3DitemPicking_017172977&src_module=topcat&src_tab_page_id=page_select_class1718930176672&mallCode=1&pageListType=2,Unknown,Unknown,4.2,22.0,200+ sold recently,Unknown
"Electric Garlic Masher, Portable Mini Garlic Chopper, Garlic Blender, Household Electric Garlic Press, Wireless Garlic Mincer, Garlic Slicer, Portable Compact Design, Easy-To-Use Kitchen Tool,Kitchen,Kitchen Items,Food,Cooking,Camping,Meat,Poultry,Room Decor,Organizer,Party.",https://us.shein.com/Electric-Garlic-Masher-Portable-Mini-Garlic-Chopper-Garlic-Blender-Household-Electric-Garlic-Press-Wireless-Garlic-Mincer-Garlic-Slicer-Portable-Compact-Design-Easy-To-Use-Kitchen-Tool-Kitchen-Kitchen-Items-Food-Cooking-Camping-Meat-Poultry-Room-Decor-Organizer-Party-p-36134210.html?src_identifier=fc%3DAppliances%60sc%3DAppliances%60tc%3D0%60oc%3D0%60ps%3Dtab22navbar22%60jc%3DitemPicking_017172977&src_module=topcat&src_tab_page_id=page_select_class1718930176672&mallCode=1&pageListType=2,#8 Best Sellers,in Kitchen Meat Grinders,9.3,0.0,Unknown,Unknown
"1pc 4-Grid Egg Frying Pan, Kitchen Baking Mold, Flower Shaped Silicone Egg Cooking Mold",https://us.shein.com/1pc-4-Grid-Egg-Frying-Pan-Kitchen-Baking-Mold-Flower-Shaped-Silicone-Egg-Cooking-Mold-p-13071942.html?src_identifier=fc%3DAppliances%60sc%3DAppliances%60tc%3D0%60oc%3D0%60ps%3Dtab22navbar22%60jc%3DitemPicking_017172977&src_module=topcat&src_tab_page_id=page_select_class1718930176672&mallCode=1&pageListType=2,#6 Best Sellers,in Egg Cookers,2.1,0.0,Unknown,Unknown
"2-In-1 Watermelon Fork Slicer Cutter, 2024 Summer New Watermelon Slicer Cutter, Watermelon Fork Slicer, Summer Watermelon Cutting Artifact, Stainless Steel Fruit Forks Slicer Knife. Dual Head Stainless Steel Fruit Forks Slicer Knife For Family Parties Camping Party, Kitchen Gadgets, Kitchen Supplies",https://us.shein.com/2-In-1-Watermelon-Fork-Slicer-Cutter-2024-Summer-New-Watermelon-Slicer-Cutter-Watermelon-Fork-Slicer-Summer-Watermelon-Cutting-Artifact-Stainless-Steel-Fruit-Forks-Slicer-Knife-Dual-Head-Stainless-Steel-Fruit-Forks-Slicer-Knife-For-Family-Parties-Camping-Party-Kitchen-Gadgets-Kitchen-Supplies-p-35401199.html?src_identifier=fc%3DAppliances%60sc%3DAppliances%60tc%3D0%60oc%3D0%60ps%3Dtab22navbar22%60jc%3DitemPicking_017172977&src_module=topcat&src_tab_page_id=page_select_class1718930176672&mallCode=1&pageListType=2,Unknown,Unknown,1.9,0.0,100+ sold recently,Unknown
"O3 Ozone Generator Air Purifier,Refrigerator Deodorizer,Food Shelf Life Extender,Remove Smoke Pet Toilet Smell",https://us.shein.com/O3-Ozone-Generator-Air-Purifier-Refrigerator-Deodorizer-Food-Shelf-Life-Extender-Remove-Smoke-Pet-Toilet-Smell-p-30029863.html?src_identifier=fc%3DAppliances%60sc%3DAppliances%60tc%3D0%60oc%3D0%60ps%3Dtab22navbar22%60jc%3DitemPicking_017172977&src_module=topcat&src_tab_page_id=page_select_class1718930176672&mallCode=1&pageListType=2,#10 Best Sellers,in Air Purifiers,6.12,40.0,Unknown,Unknown
1pc 4D Multifunctional Lifting And Tightening Massage Instrument For Home Use - One Tool For Total Body Beauty And Skin Care,https://us.shein.com/1pc-4D-Multifunctional-Lifting-And-Tightening-Massage-Instrument-For-Home-Use-One-Tool-For-Total-Body-Beauty-And-Skin-Care-p-27482222.html?src_identifier=fc%3DAppliances%60sc%3DAppliances%60tc%3D0%60oc%3D0%60ps%3Dtab22navbar22%60jc%3DitemPicking_017172977&src_module=topcat&src_tab_page_id=page_select_class1718930176672&mallCode=1&pageListType=2,Unknown,Unknown,4.66,20.0,100+ sold recently,Unknown
"5 In 1 Multi-Function Electric Scrubber  Portable Spin Scrubber, Cordless Handheld Cleaning Brush For Bathroom/Tub/Wall Tiles/ Floor/Kitchen Usb Rechargeable Kitchen Dish Washing Brush Sink Cleaner Bathroom Bathtub Clean Brush Spin Scrubber Electric Cleaning Brush",https://us.shein.com/5-In-1-Multi-Function-Electric-Scrubber-Portable-Spin-Scrubber-Cordless-Handheld-Cleaning-Brush-For-Bathroom-Tub-Wall-Tiles-Floor-Kitchen-Usb-Rechargeable-Kitchen-Dish-Washing-Brush-Sink-Cleaner-Bathroom-Bathtub-Clean-Brush-Spin-Scrubber-Electric-Cleaning-Brush-p-33421284.html?src_identifier=fc%3DAppliances%60sc%3DAppliances%60tc%3D0%60oc%3D0%60ps%3Dtab22navbar22%60jc%3DitemPicking_017172977&src_module=topcat&src_tab_page_id=page_select_class1718930176672&mallCode=1&pageListType=2,Unknown,Unknown,5.96,47.0,10+ sold recently,Unknown
"1pc 10ml Oil-Based Aroma Refill, Suitable For Aromatherapy Candles, Fragrance Stones, Aromatherapy Plaster, Not For Humidifiers",https://us.shein.com/1pc-10ml-Oil-Based-Aroma-Refill-Suitable-For-Aromatherapy-Candles-Fragrance-Stones-Aromatherapy-Plaster-Not-For-Humidifiers-p-28352242.html?src_identifier=fc%3DAppliances%60sc%3DAppliances%60tc%3D0%60oc%3D0%60ps%3Dtab22navbar22%60jc%3DitemPicking_017172977&src_module=topcat&src_tab_page_id=page_select_class1718930176672&mallCode=1&pageListType=2,Unknown,Unknown,1.6,0.0,1.6k+ sold recently,Unknown
Electric Hair Straightener Brush Straightening Curler Hot Comb LCD Display Flat Iron,https://us.shein.com/Electric-Hair-Straightener-Brush-Straightening-Curler-Hot-Comb-LCD-Display-Flat-Iron-p-19897495.html?src_identifier=fc%3DAppliances%60sc%3DAppliances%60tc%3D0%60oc%3D0%60ps%3Dtab22navbar22%60jc%3DitemPicking_017172977&src_module=topcat&src_tab_page_id=page_select_class1718930176672&mallCode=1&pageListType=2,Unknown,Unknown,23.5,0.0,Unknown,Unknown
1pc Silicone Ice Cube Trays With Lids,https://us.shein.com/1pc-Silicone-Ice-Cube-Trays-With-Lids-p-25454957.html?src_identifier=fc%3DAppliances%60sc%3DAppliances%60tc%3D0%60oc%3D0%60ps%3Dtab22navbar22%60jc%3DitemPicking_017172977&src_module=topcat&src_tab_page_id=page_select_class1718930176672&mallCode=1&pageListType=2,Unknown,Unknown,3.9,29.0,30+ sold recently,Unknown
1pc Kitchen Long-Handled Noodle & Soup Strainer Ladle With Drainer,https://us.shein.com/1pc-Kitchen-Long-Handled-Noodle-Soup-Strainer-Ladle-With-Drainer-p-35622960.html?src_identifier=fc%3DAppliances%60sc%3DAppliances%60tc%3D0%60oc%3D0%60ps%3Dtab22navbar22%60jc%3DitemPicking_017172977&src_module=topcat&src_tab_page_id=page_select_class1718930176672&mallCode=1&pageListType=2,Unknown,Unknown,1.7,0.0,Unknown,Unknown
Unknown,Unknown,#10 Best Sellers,in Other Body Care Machines,2.7,0.0,Unknown,"4pcs Makeup Sponge Beauty Egg Set - Makeup Sponge For Foundation Blending With Egg Holder, Perfectly Used For Cream, Powder, Blush, Concealer, And Liquid"
Unknown,Unknown,#1 Best Sellers,in Hair Dryers,4.38,32.0,Unknown,1pc Salon Tools Black Pink Universal Silicone Hair Dryer Diffuser Hood Adjustable Temperature Dispersion Resistant Drying Hair Dryer
Unknown,Unknown,#2 Best Sellers,in Electric Nose & Ear Trimmers,2.86,25.0,Unknown,Portable Lithium Battery Powered Hair Trimmer & Nose Hair Trimmer
Unknown,Unknown,#7 Best Sellers,in Juicer & Food Processor,3.46,51.0,Unknown,"Multifunctional Manual Food Chopper, Kitchen Vegetable Fruit Onion Garlic Nuts Herb Slicer, Hand-Powered Mixing Cutter, Green"
Unknown,Unknown,#7 Best Sellers,in Cleaning Appliance Parts,2.4,0.0,Unknown,"1 Set Of 2 Portable Fan Cleaning Brushes, Household Multi-Purpose Keyboard And Gap Cleaning Small Brush - Deep Into The Gap, Easily Remove Dust."
Unknown,Unknown,#8 Best Sellers,in Electric Toothbrushes,2.6,0.0,Unknown,"Smart Electric Toothbrush With 6 Modes 42000vpm & Smart Timer - Effectively Cleans Teeth & Gums, Rechargeable USB Electric Toothbrush With 4/8 Replacement Head, Electric Toothbrush For Adults, Available In 3 Colors, Great Gift Father's Day Gift"
Unknown,Unknown,#5 Best Sellers,in Electric Nose & Ear Trimmers,2.1,46.0,Unknown,1pc 12.7cm Aluminum Metal Electric Battery Type Eyebrow Shaver Nose Hair Trimmer
Unknown,Unknown,Unknown,Unknown,35.0,0.0,Unknown,"Professional Curler, Electrically Heated Automatic Curler, Negative Ion Electric Clip Curler, Portable Heated Hair Styling Tool For Home Use, Salon, Hair Salon, Mother's Day Gift"
Unknown,Unknown,#9 Best Sellers,in Specialty Kitchen Appliances,4.4,0.0,Unknown,"1pc Mini Bag Sealer, Rechargeable Portable Sealing Machine, Handheld Plastic Vacuum Sealer For Kitchen Packaging"
Unknown,Unknown,Unknown,Unknown,2.95,16.0,100+ sold recently,"New Mini Nail Lamp Portable Led Uv Lamp Usb Nail Dryer For Gel Polish, Single Finger Curing"
Unknown,Unknown,#3 Best Sellers,in Refrigerators & Freezers,34.99,54.0,Unknown,"Reemix Mini Fridge, 3.7 Liter/6 Can Portable Cooler And Warmer Personal Refrigerator For Skin Care, Cosmetics, Beverage, Food,Great For Bedroom, Office, Car, Freon-Free"
